ID,Content_Type,Image_Type,Category,Colors,Editor_Choice,Order,Tags,Views,Downloads,Likes,Comments,URL
9423918,authentic,illustration,Unknown,Unknown,Unknown,popular,"ai generated, lily of the valley, flower, vase, nature, spring, bloom, narcissus, flora, seasonal, watercolors, painting, floral",660,525,46,9,https://pixabay.com/get/g95150b5a804cb7d25393dcf7917aa893c6c656562e27e1f6f874498e935bbc24a845be2e38b31b812d5a5da251ad2ef9562038a5c2aa4cfc3f60442a5a965235_1280.jpg
9462374,authentic,illustration,Unknown,Unknown,Unknown,popular,"flowers, retro, ladybug, drawing, floral background, nature, bloom, summer, leaves, bouquet, background",98,75,4,1,https://pixabay.com/get/g1efe15989353bb7dd5438c796b6242ded6861a769c5e7df8705a3724edd4220ba37fcc987bffa907749e3de50461511fb529004c1773a6a5c1d955b5ff415a6a_1280.jpg
5997134,authentic,vector/ai,Unknown,Unknown,Unknown,popular,"bell, subscribe, button, social media, subscribers, videos, follow, youtube, ring, subscribe, subscribe, subscribe, subscribe, subscribe, youtube",150097,115522,104,46,https://pixabay.com/get/g79289096c588b5c513a4e321858f4898058aa3e42fdae14ec36fda179c28eabd53d0ced67e3fdd526a0297a3796349059c4fd1ab268bb9e9f2b9488fc86e8567_1280.png
9431932,authentic,illustration,Unknown,Unknown,Unknown,popular,"jesus, christ, cross, christianity, crucifixion, church, religion, faith, easter, christian, symbol, god, ai generated",943,744,42,10,https://pixabay.com/get/g5029bd7eb467687c13c34d0ad43dad64f269cc1447410825be01aedb8e26fc65a53b1d9b7567d32e38ed67ca42bc0c0ee9bd6d8c85f0b85956e77d62b8e577b0_1280.jpg
6590887,authentic,vector/ai,Unknown,Unknown,Unknown,popular,"christmas, new year, greetings, merry christmas, happy new year, christmas trees, snowflakes, snow, winter, xmas, gold, nature, decoration, holiday, celebration, greeting card, design, template, christmas, christmas, christmas, christmas, christmas, new year, merry christmas, merry christmas, merry christmas, merry christmas",42370,24689,105,20,https://pixabay.com/get/gc3eae67447d933ebb1f515df83366405ba73a818eb117f82aa931fdfccbc01919966aa35dfd158631febbd038026e0a7342edeb5615abe0c6838d5dd38cc74bc_1280.png
9431844,authentic,illustration,Unknown,Unknown,Unknown,popular,"mardi gras, mask, masquerade, carnival, festival, costume, party, louisiana, parade, colorful, feathers, holiday, festive, celebration, disguise, lent, beads, masks, new orleans, nola",1108,903,35,11,https://pixabay.com/get/gc9d1f85a91492843f7c984feff623ebea2dc284887bb8e85e0f8546a34ec3d0dc4ab5155db8b03df92e32e6c59b6098064ad3f62d5204449183394953c61de28_1280.jpg
6838204,authentic,illustration,Unknown,Unknown,Unknown,popular,"christmas background, christmas tree, christmas gifts, christmas decoration, background, cut out, christmas, isolated, transparent, iphone wallpaper, christmas background, christmas tree, christmas tree, christmas tree, christmas tree, christmas tree, christmas",113733,92896,213,43,https://pixabay.com/get/g973aa652b2aaa6b5a44867e112170997f9c4b843137c034c842db20d383d6d56ad72b6cb52090f13f11488de5c9eb051c871352cff2f771c6530e058e5917905_1280.png
7200102,authentic,vector/svg,Unknown,Unknown,Unknown,popular,"pugs, nature, dogs, pet, domestic, puppy, canine, cartoon, animal, dogs, dogs, puppy, cartoon, cartoon, cartoon, cartoon, cartoon",44162,28154,203,45,https://pixabay.com/get/g129a5b3b7beae0eaefaa22e38f82ef8bdaa17e3f999978454f527700df3cf7aeb308dd8f99cb488ce31978a54fb92789df4de654f4d46458918fa193b5c83ea7_1280.png
9460042,authentic,illustration,Unknown,Unknown,Unknown,popular,"hekate, greek mythology, goddess, paganism, greek, greek goddess, mythology, pagan, magic, fantasy, artwork",153,126,9,0,https://pixabay.com/get/g8d7a72ddb414e15f135e2207de1370cd2a3ab1ad042383c274175e903d42fe103d3df42982fcd1c5b9ce9fd6742d739155f9e2ac34503daee4d7e5ba42d0fd4d_1280.png
9437252,authentic,illustration,Unknown,Unknown,Unknown,popular,"weather, climate, meteorology, forecast, atmosphere, nature, temperature, precipitation, wind, clouds, humidity, pressure, observation, satellite, radar, data, prediction, climate change, world meteorological organization, awareness, education",718,601,42,9,https://pixabay.com/get/gd03107769f9dc332870a3e04b6f7d19029cb98cc5e30c72fe178eb544801ed751f1b07f05c14ceefe703751668eb38bcf59972c930984100ab42e66e64632280_1280.png
11111,authentic,illustration,Unknown,Unknown,Unknown,popular,"solar system, planets, planetary system, orbit, sun, mercury, venus, earth, mars, kuiper belt, jupiter, saturn, uranus, neptune, pluto, nature, comet, starry sky, space, universe, night sky, heaven, astronautics, nasa, space travel, solar system, solar system, solar system, solar system, solar system, sun, earth, space",486334,210707,1193,321,https://pixabay.com/get/g19de0e39b1594a4135ae3843e9c2978f52926c9fb5b0e060b903057b7ae6802b1c5dae3d346d7e6613f1f3b6de81622e_1280.jpg
9460816,authentic,illustration,Unknown,Unknown,Unknown,popular,"ai generated, suitcase, baggage, travel, holiday, cartoon",36,27,12,3,https://pixabay.com/get/g883ddb2a9f120dcf1ccfef60cca90d0f7b7a1ab2bc23625dff59b3833bb9db004cef7f23d6a9cf0a396e130055cc99d2a11ea0c8f26907efec0292fa635be5ca_1280.png
9460746,authentic,illustration,Unknown,Unknown,Unknown,popular,"ai generated, cave, ice, cold, winter, snow, frozen, cavity, nature",36,20,11,2,https://pixabay.com/get/gc6b147422c45babf28527b8f190ed16c43cbc0b6bca2b5c14deeda3c7254cead11ae78da8bbcb5799774589f2f7413068d2aad24fbf915db733853a5ce484540_1280.png
9458073,authentic,illustration,Unknown,Unknown,Unknown,popular,"ai generated, apple, fruit, food, healthy, delicious, sweet, design, art, table, wood, light, fantasy",113,99,12,3,https://pixabay.com/get/ge5453e79d1a4db6c37e62fa09c993e5f142dac213e78d335722d671b245947c8fc4aae8478ed4953b97ab1215f51a1d55afec7dcfb2ee0e8883a74e054141a36_1280.png
7787970,authentic,illustration,Unknown,Unknown,Unknown,popular,"bird, nature, forest, plant, leaves, monstera, wings, fly, floral background, tropical, colors, beak, background, design, drawing, texture, theme, green, sheet, bird, bird, nature, nature, nature, forest, forest, forest, forest, forest, plant, leaves, monstera, background, background, background, design",54350,34474,216,28,https://pixabay.com/get/g14d9b4e73d58353504d4d046f5fcf89381c45abb7d6890429a863e3efc333708bae565223d60ba7cc9b597a4447e83e94bbe35b4f63fd512017ca32cf2008b3d_1280.jpg
5190738,authentic,illustration,Unknown,Unknown,Unknown,popular,"moon, grass, nature, reed, fairytale, imagination, mood, aesthetic wallpaper, iphone wallpaper, moon, moon, iphone wallpaper, iphone wallpaper, iphone wallpaper, iphone wallpaper, iphone wallpaper",113066,67595,589,63,https://pixabay.com/get/g05addf3eb8e273063df00fffbcb816321d771c69e372aaa59289ca37d85a3e8c7140331b7225d57586ca756dd15ab68d3ea4ed9c6ecac2caa52570a8c6e855c2_1280.jpg
7137533,authentic,vector/svg,Unknown,Unknown,Unknown,popular,"frame, floral frame, floral wreath, copy space, beautiful flowers, flowers, frame, flower wallpaper, nature, frame, frame, frame, frame, flowers, flowers, flower background, flowers",54180,34204,159,25,https://pixabay.com/get/g808149f9f2f025b3d5dde470ee8d285cb055001355e9240a89b4dd4e3b5b424671fda4b51cade084a33c302710d31fc2a8311bb6d07d58fe2a7e400e5a0d6351_1280.png
1789175,authentic,vector/ai,Unknown,Unknown,Unknown,popular,"background, lines, shapes, abstract background, background image, geometric, wallpaper, beautiful wallpaper, yellow, pink, stripes, colour, design, background, background, background image, background image, background image, background image, background image",196786,91709,723,147,https://pixabay.com/get/gf28e50f05af68fadc61bfc6c37793cb46f827fb0aa240efab49a60d2431140aa8ac3117d9588bf87b89a08f32f6a029361cddb7174142f4850ee09a09fbea2cf_1280.png
9453850,authentic,illustration,Unknown,Unknown,Unknown,popular,"ai generated, cat, character, feline, fantasia, cute, jaguar, snow, watch, coat",46,41,16,1,https://pixabay.com/get/g396227bfbc42b9b0625ebf65474e8d82f93f4b2852d54a6709fcb6a89bbd854d455498218f155e48c0cfa82030ac739306c9a24cc185d1988f4d52252e4f6557_1280.jpg
9449384,authentic,illustration,Unknown,Unknown,Unknown,popular,"ai generated, women, globalization, integration, multiculturalism, cosmopolitanism, inclusion, collaboration, networking, internationalism, unity, diversity, adaptation, togetherness, community",233,191,26,4,https://pixabay.com/get/g520b73f2ca7c33fee9f735dbbb3cd91981742551775b0c3386f97234887d05023f8a28ef72b96b9c2d588a1a7d4592e54d907a33a7b544cc51430a7002bb9a17_1280.jpg
9427810,authentic,illustration,Unknown,Unknown,Unknown,popular,"crocus, spring, flower, blossom, bloom, plant, sun, spring picture, spring flower, warmth, thaw, flora, floral background, nature, natural reserve, protection of species, wilderness, bloom, petals, pollen, nectar, pollination, wildflower, snow, background",852,722,48,0,https://pixabay.com/get/ga3a3ee566f1e1cfa8d717f6d74f4ffa641e1285d0167ef0a5e3181607dccce910df1372f91c5d29cd78136c0d7ebc1b60e499da5bf921486faac719e2f6c65d0_1280.jpg
9431931,authentic,illustration,Unknown,Unknown,Unknown,popular,"jesus, christ, cross, christianity, crucifixion, church, religion, faith, easter, christian, symbol, god, ai generated",798,644,41,8,https://pixabay.com/get/gc6332046abf1b9fc29c40da39081bbf3e06ef133c30438a0009a80a94aed303bb95ad22f93499f870ff7841c6f4e0d6b269fbf09e99db2784b1bfa9fb88900f0_1280.jpg
2410588,authentic,vector/ai,Unknown,Unknown,Unknown,popular,"ribbon, red, decor, for the web, plate, transparent background, banner, graphic arts, pointer, element, gradient, navigation, design, decoration, label, sample, ribbon, ribbon, banner, banner, banner, banner, banner",320314,213071,409,103,https://pixabay.com/get/g5167f5c560649e1cd5181e81a8bf5faf5a8353d04e4d56b7163549c72a58e06fbffe21d99d0a3dd3ef7c9f37032fecedb2bfd6380376c2ec38d1fcf206f730a0_1280.png
9458066,authentic,illustration,Unknown,Unknown,Unknown,popular,"purple, metallic, apple, fruit, smoke, art, ai generated",55,38,7,0,https://pixabay.com/get/g7d08e7acbba3b4f38353d1a8d5b9cb216abf67af723c0f3b53fd3bdc007e9b676748ab4bd467e6a69f6677cf8c8d7fdbd0d8ee91e15872f9beb3d01651fd3485_1280.png
9468688,authentic,illustration,Unknown,Unknown,Unknown,popular,"background, wallpaper, digital, graphic, pattern",60,58,1,0,https://pixabay.com/get/gb48cf648f87eb7bee9d79165166a4a58f773b7f9e387e1fa29b426ce8100ac64bb45a4e61e94a88d9217d0363d8b690fade292af8cc504cb9282bbb79651a64b_1280.png
6833367,authentic,vector/svg,Unknown,Unknown,Unknown,popular,"reading, books, man, stack, education, cartoon, studying, knowledge, human, sitting, school, wisdom, learning, intelligence, leisure, student, expertise, story, university, literary, research, literature, bookstore, magazine, college, reading, education, education, studying, learning, learning, learning, story, research, research, research, research, research",64387,50566,117,10,https://pixabay.com/get/g60a5eeee2bccbd24b9e9f96ae2e33856e19258c1aa6767c92bc095b287e246dc0f4130f32a358315b48c3e1c1a747de7e4a24be39020c16e21247420198f315b_1280.png
2310212,authentic,illustration,Unknown,Unknown,Unknown,popular,"fruit, lemon, art, pattern, design, painting, drawing, sketch, watercolor, fruit, fruit, fruit, lemon, lemon, lemon, lemon, lemon, art, art, pattern, pattern, pattern, painting, painting, drawing, watercolor, watercolor",277490,146741,1202,187,https://pixabay.com/get/gba3b5496641c571c647e77fcd5ba5a65b4928cd12da6c3276dc1dea6a7fd4ed38e72437a916e70ab2b44b6e9762e2071bf5ed649a14839090255938f3bb3cffa_1280.jpg
9450068,authentic,illustration,Unknown,Unknown,Unknown,popular,"text, phrase, french, language, eiffel tower, flag, kiss, heart, romance, paris, culture, vocabulary, grammar, literature",220,176,26,6,https://pixabay.com/get/gc1ecc4bf874106f58ebe31e828c3c116d77ff1a2bb212ce9310fa42b90227f5ad3bbf1e5b6dd078abcfe84fc96315a0cab7cd6439ce5e4a4a8bcd118c9501747_1280.png
7617694,authentic,illustration,Unknown,Unknown,Unknown,popular,"virgo, star sign, astrology, horoscope, fantasy, ai generated, background, birthday card, zodiac, symbol, shining, virgo, virgo, virgo, virgo, virgo, astrology, horoscope, zodiac",37406,29000,256,31,https://pixabay.com/get/ga09ae099fdfbb917b030c25732288751d03bdf5a741583f0545069511e4b9b5183308967be693f6d54c9476e2d8c44eb2b83f05491597f04bab0e4af0ec67aa3_1280.jpg
7551966,authentic,vector/svg,Unknown,Unknown,Unknown,popular,"divider, flourish, line art, separator, decorative, ornamental, decoration, vintage, old, retro, antique, cut out, divider, divider, divider, divider, divider",18454,13863,108,3,https://pixabay.com/get/g8f1e7f2c461a7e42b2c7e9f0326a88dd5647182fddc6d4b0e008c3b1a4a1c25912adb9e208088e7e7f5a5b1ff6a6e2c277896d0a20d2ad379e6738e1aecdb01d_1280.png
9444334,authentic,illustration,Unknown,Unknown,Unknown,popular,"ai generated, nature, foxes, red fox, wildlife, animal, mammal, forest",365,307,30,0,https://pixabay.com/get/g8cced4519fa795270a0a80b6b4bcbad54f1dbd21a2bd0989ac7ef2ba3eea92fb8add5292b695bf588bdab6c111a1ea6d5c9882e60933a8c2af6d618ba241de74_1280.jpg
5381733,authentic,vector/svg,Unknown,Unknown,Unknown,popular,"heart, love, diversity, cooperation, caring, humanity, people, humankind, volunteer, helping, care, share, sharing, togetherness, harmony, peace, unity, united, colorful, nature, prismatic, chromatic, rainbow, heart, heart, love, rainbow, rainbow, rainbow, rainbow, rainbow",175857,153603,376,99,https://pixabay.com/get/g01a6fc9efc64c68ee2d28e2a598f7c4010f551d9ddf042bb8574c3fbe54c71e148ced5c5accdba40eafb45534306d25332d2eec0eb1356b400bccaadbef2bc5c_1280.png
9450046,authentic,illustration,Unknown,Unknown,Unknown,popular,"eye, cat's eye, cat, closeup, macro, background, ai generated",211,171,23,0,https://pixabay.com/get/g69f398db143fa43d21f114a4c32117ee4b8ef108357034c7653969d112d426238df08f9cf6f182092097c21a6a53f6e90c853c5c1aec215e2589c110c7fd5591_1280.jpg
9332036,authentic,illustration,Unknown,Unknown,Unknown,popular,"roses, vase, flower, petals, bloom, valentine's day, red, love, nature, rose petals, flower vase",3159,2652,89,15,https://pixabay.com/get/g8d7b9cec1324635c01873b6a503fa0efa682b63cdf48ec4a99c10e1e6899f665e93a23fa0689d58517393b2e53685e1ec0f92cefc1f31bb82e10a7b6347c589a_1280.jpg
9445190,authentic,illustration,Unknown,Unknown,Unknown,popular,"ai generated, martian, alien, ufo, monster, cosmic, creature, fantasy, face, cartoon",300,224,23,5,https://pixabay.com/get/g6fa4f5988322ee726d797f916e4a6de5740eb472058883658fbe854c16bd9ddad67d9020aa9f06c04bce5c5004aaa652c159590ec793414a2b7e1cfae354cec3_1280.png
9298574,authentic,illustration,Unknown,Unknown,Unknown,popular,"new year's day, celebration, new year's eve, sylvester, lucky charm, annual financial statements, turn of the year, year",18978,6056,16,2,https://pixabay.com/get/g2929c689d4e1666b1aad8bbb125db8f3303e7f408f3bb63792ac5b014f452712d53d99cb103b0528972de2dc77d0dc46e9e5c45fd20a9b1f5dc5005674db92d0_1280.jpg
8689514,authentic,illustration,Unknown,Unknown,Unknown,popular,"ai generated, krishna, god, hinduism, hindu, vrindavan, india, krishna, krishna, krishna, krishna, krishna",10013,5359,36,2,https://pixabay.com/get/gcb9dc50a46883cb633733503ac412507c994ac02397b73288bfdb21b78e02035ae068857828ccd55969145538ed7fc061cc06860575b1858f83a70ad84b7efc5_1280.jpg
9444530,authentic,illustration,Unknown,Unknown,Unknown,popular,"ai generated, birds, animals, wildlife, nature, spring, blossom, flowers, tree, branch, sunset, landscape, twilight",428,368,29,12,https://pixabay.com/get/g218b5440fc0b30806e2a3b629785c262e766fa5fb4a9fe04e34ae27069199b847202ff880ed966bde92f27269d0e3360cbd9b8754fabacf75e45687fa1fe089c_1280.jpg
7354939,authentic,vector/svg,Unknown,Unknown,Unknown,popular,"seat, sofa, chair, furniture, home, room, interior, living room, chair, furniture, home, home, home, room, room, room, room, room, living room, living room, living room",43650,31876,184,36,https://pixabay.com/get/g0b0999781e0fd9f01c0d82ffc3bde1b448ff7671a61836aa889c342b743f7ea0273c66510182dd6b2394ac6e6c137fdfc9a78d257a2c45299812c739ca43db54_1280.png
9445167,authentic,illustration,Unknown,Unknown,Unknown,popular,"ai generated, girl, beauty, pose, sitting, sadness, loneliness, solitary, lounge chair, gloomy, portrait",459,345,31,5,https://pixabay.com/get/g93054f42af599a36df1eb76d1b9adce93b37c2df87006e17ce2be563148fa83b701da7b7303ff18d261575867911756958506ce7f39e31f154cae1d22bf1f4a4_1280.jpg
9453214,authentic,vector/svg,Unknown,Unknown,Unknown,popular,"headset, display, lenses, sensors, tracking, field of view, resolution, refresh rate, comfort, immersion",526,495,23,2,https://pixabay.com/get/gb2d69570313bf0f1d3cabb42bdb177d5c0de49191548f8964fc15fb8d86ba574c792a0be6ceee12e4a79949cc34dbbe89c4329655d41020eb6072249ec8152a8_1280.png
5674148,authentic,illustration,Unknown,Unknown,Unknown,popular,"jack-o-lanterns, pumpkins, halloween, carved pumpkins, lanterns, illuminated, halloween lanterns, halloween decoration, halloween decor, halloween, halloween, halloween, halloween, halloween",88228,48573,268,29,https://pixabay.com/get/ga981d109ac0072c5c55781bedc426824c8516faf68e871a8639f4fc2725591a019dd96abf1a13a88f65b2ca56d0d5ee3aa132b726e3726054c2b780ce0f70add_1280.jpg
2389219,authentic,vector/ai,Unknown,Unknown,Unknown,popular,"list, icon, symbol, paper, sign, flat, note, form, mark, business, document, check, report, page, test, sheet, board, checklist, office, web, pictogram, notepad, design, data, text, template, checkmark, tick, file, white, notebook, menu, marketing, choice, list, list, list, form, form, report, test, test, test, checklist, checklist, checklist, checklist, checklist, data",372903,199329,627,87,https://pixabay.com/get/gd00b4850c2feca42c7fa54ce8820869fcecf4ab055a434d4782ccca0c9301bb773d6a450c4f8def84ddecee87916a7b18c5563b4a9918d71f9509391fe25b243_1280.png
9431845,authentic,illustration,Unknown,Unknown,Unknown,popular,"pattern, texture, abstract, design, modern, shape, artwork, twirl, swirl, fractal, colorful, decorative, blended, gradient, illusion, light, background, scrapbooking, template, bright",959,876,40,16,https://pixabay.com/get/g87f440ca9370f4e0f629ff6e685c52b437cae9997e3e0f6c819092250970fd7bdf1d1ae7057b721e8c1dd603973fa64c91a073d268df7d3cce51e5c1e8ed5655_1280.jpg
9453527,authentic,illustration,Unknown,Unknown,Unknown,popular,"ai generated, samurai, warrior, japan, sword, japanese, katana, character, weapons, avatar",157,132,14,1,https://pixabay.com/get/g5ecd37bad403cbbf05f56d688ff2a093716e05011d7927f8665720b99578947f08b9f7f5e291df469703baab4ee2a922ecab3effd12995ba9c917498557727ec_1280.png
9438279,authentic,illustration,Unknown,Unknown,Unknown,popular,"ai generated, stairway, stairs, watercolor, fantasy",376,323,34,4,https://pixabay.com/get/g94d97fba503cb6182a7178cd481aa0b8a2be6dd2f1ebfa544791a9788fcb42fdfbc9bf85420a4c80474f644ae6a260c2ef3ea375f770460fe529cf145c941cb6_1280.jpg
5706627,authentic,illustration,Unknown,Unknown,Unknown,popular,"reindeer, stars, socks, stick, candy cane, chirstmas tree, christmas, winter, nature, cozy, retro, december, vintage, home, holiday, leaves, tree, warm, decor, art, doodle, pattern, happychristmas, christmas, christmas, christmas, christmas, christmas",122837,81903,334,41,https://pixabay.com/get/g2d8895d6aad56dfc45a43ffd52912e6b6faf8e9678610a653d093fafbcb0de19116d58c89d68d1efef68129b2118d49fad9bf972b017a63d890c9338b2689471_1280.png
9438629,authentic,illustration,Unknown,Unknown,Unknown,popular,"weather, climate, meteorology, forecast, atmosphere, temperature, precipitation, wind, clouds, nature, humidity, pressure, observation, satellite, radar, data, prediction, climate change, awareness, education",742,647,36,6,https://pixabay.com/get/gaab5601160ff863bc8edf22110fa441cefa5f82b8f9a764b4d5932cdcd5b36b842bb5fa2fbd088d7b1e4cbdd78562e6b9f88a2265edec2f0bcefdbc86a841e5f_1280.jpg
9438278,authentic,illustration,Unknown,Unknown,Unknown,popular,"ai generated, stairway, stairs, watercolor, fantasy",384,307,34,5,https://pixabay.com/get/g1c4472a6027be093e00f6137df6f362995beef1a72dff9106731a602e253cb1082f7052727970969803a3b2b56d62c40bae17f92b44ce9de3828be9007ac6268_1280.jpg
9426675,authentic,illustration,Unknown,Unknown,Unknown,popular,"statue of liberty, monument, usa, statue, america, landmark, freedom, nyc, sculpture, symbol, architecture, city, attraction, famous, icon, independence, liberty, moon, night, skyline",1220,1073,41,15,https://pixabay.com/get/gc6b0f42deb0b99db80ace3422272bf982c23fd0d9ce95bb12410e88737478c43ce6aa23a2857ccb7f8ec20cd6227f859380739bb3338d66125394127493a0b4a_1280.jpg
9436405,authentic,illustration,Unknown,Unknown,Unknown,popular,"hearts, pattern, seamless, texture, love, nature, symbol, romantic, design, happyvalentine's, floral background, flowers, bloom, blossom, flora, bud, delicate, pastel, scrapbooking, background, cutout",1239,1171,29,8,https://pixabay.com/get/g33be8a9f648067217ff8b21a0dda64e4120b4e05f50442f9e5a7fe07a716dd83cb5ac33032be46a62978bd4a24235ea20ef0ea2aea0051149e5dd21c4439f2fb_1280.png
9426676,authentic,illustration,Unknown,Unknown,Unknown,popular,"spider, halloween background, black widow, pattern, insect, nature, poisonous, animal, dangerous, venomous, female, arachnid, seamless, texture, scrapbooking, background, cutout, halloween, scary",1292,1218,41,13,https://pixabay.com/get/g7726d1348c57ce7e1b95fdfc40c4a7dd983e4d94411e062084f85e5c2b32a5bb9ce2f65ea6571075e5549a0b0fca23f23d1832ada710563b2b018d8e45336191_1280.png
9083231,authentic,illustration,Unknown,Unknown,Unknown,popular,"ai generated, decoration, nature, holidays, winter, christmas background, snow, globes, spheres, mock-up, framework, christmas",5065,2646,21,1,https://pixabay.com/get/g455823b8e31a629f0b415217f72ff117095bb9503a40fa16c76ca2811fbbb746a5dd4f8bf53e416fbd6491e46b00d428f2f11321bc0360c928a51f69467a597e_1280.jpg
9444835,authentic,illustration,Unknown,Unknown,Unknown,popular,"ai generated, bird, red cardinal, cardinal, nature, ornithology, wildlife, animal, plumage, snow, winter, winter pictures, background",353,319,27,0,https://pixabay.com/get/gb466129bbfdf4a10f486be04396f42569a489ca088bc36d3244b1ea5bbece71de8c9c55168859f2b2e300fc6aa431a6855d4021aa6ef6733eafcfc0dbb7a47e8_1280.jpg
9431849,authentic,illustration,Unknown,Unknown,Unknown,popular,"buildings, architecture, facade, urban, modern, glass, windows, structure, exterior, brick, masonry, store, shop, market, retail, business, cartoon, street, colorful, landscape, cityscape",889,835,36,12,https://pixabay.com/get/g4cc99e3ebf277d3a640c4bd5f9f363b0c566b87e13050892355ca0fa5203845fe0ba30b12e7874385ac35ba4a9dde83a01c3c79bc3271d37a49855374ebdfe70_1280.jpg
9436445,authentic,illustration,Unknown,Unknown,Unknown,popular,"world water day, water, resources, conservation, nature, sustainable, water management, hydration, ecosystem, environmental protection, water cycle, sanitation, sustainability, global water crisis",701,588,41,6,https://pixabay.com/get/ga4fab06f9dc1d85b54b7617987dd49c7a9b0aaccfc613173e49ca75ef774f905ae119ec104fc56f1c06b6fe28e813cc23ee1d73fcfef689703dc14ed18716444_1280.png
9444302,authentic,illustration,Unknown,Unknown,Unknown,popular,"ai generated, flower, spring, nature, plants, spring flowers, background, awakening, blossom, bloom",343,326,27,0,https://pixabay.com/get/g5b56cf487af4fff695439c92cdcec878d3aba311969d1502657c43dc2e2a6e952a13d46bfcc94e7cf48b275c2fef97e9cd671749e91a2325faa11007af8c24ee_1280.jpg
9471298,authentic,illustration,Unknown,Unknown,Unknown,popular,"ai generated, pirate, skull, symbol, swords, fantasy",16,13,4,1,https://pixabay.com/get/g59020df6a3f1c5d695e1008e3671d1f1bf0e90804e0ca94f45937290416bf03fff3add0823ceff209e28e7238f74e8bc9e80c7ecbd91c5464921a15f14a02133_1280.png
6848950,authentic,vector/svg,Unknown,Unknown,Unknown,popular,"personality, unique, different, alone, way, path, choose, silhouette, people, crowd, community, road, concept, courage, motivation, difference, man, think, individual, social, decision, destination, street, walk, apart, unique, unique, unique, different, different, different, alone, people, crowd, crowd, courage, motivation, motivation, motivation, motivation, motivation",57952,46949,139,23,https://pixabay.com/get/gf5ea502917a206065adaf481a5449e854bd72704dea0a873ea0669e4532776ab9a74fac1949282c397bd7da7026c2d42f443dc3fa7aa66a7f3a2732ee733f9fb_1280.png
8585511,ai,photo,Unknown,Unknown,Unknown,popular,"ai generated, angel, heart, hand, well, ai, aigenerated, wings, statue, stone, ai generated, ai generated, ai generated, ai, ai, ai, ai, ai",7160,6033,42,3,https://pixabay.com/get/ga109bc37220502017c037e769e1681f82a8937794ff7104d9ddfb425d1b7fadeace7802b5b07b0b6ee3b910e8c8df0e18cf75cc89375a21622e36addd969c2b9_1280.jpg
7867137,ai,photo,Unknown,Unknown,Unknown,popular,"mountains, peak, summit, sky, stones, hike, meditation, horizon, seven lakes, ridge, valley, scenery, bulgaria, nature, landscape, rila, mountain, ai generated, mountains, meditation, meditation, meditation, meditation, meditation, scenery, bulgaria, bulgaria, bulgaria, ai generated, ai generated, ai generated, ai generated, ai generated",55113,50075,98,3,https://pixabay.com/get/gd8fdc17517113e59458d460f14cf9f8b208fdaf9cf809abcac2a52099eec287964ca30345dc2209dd0272fe0179515dcc8b5d71ebf4f826f5c0d82de84911eb7_1280.jpg
7611668,ai,photo,Unknown,Unknown,Unknown,popular,"path, forest, trees, ai generated, fantasy, autumn, foggy, ai generated, ai generated, nature, ai generated, ai generated, ai generated",5439,4711,42,2,https://pixabay.com/get/g058c52c844196040e625d2b7d4454b116c2bfde63e75361b1dcaf236c5b597dfd3dc6f3c02d61cf2e878fe0ebeb2b8a7fc01c06116918233363b7756181b52f1_1280.jpg
7718952,ai,photo,Unknown,Unknown,Unknown,popular,"ai generated, flower, cherry blossom, sakura, blossom, branch, beautiful flowers, tree, pink, spring, plant, flower background, flower wallpaper, bloom, flowering, beauty, nature, ai generated, ai generated, flower, cherry blossom, cherry blossom, cherry blossom, sakura, spring, spring, spring, spring, spring",435346,389596,556,60,https://pixabay.com/get/gd0c15749cd53d54da1505476f9faf863cfe3094ea7718a95f411a92974917e49b773c0bd2b2ee75e6bdb7cb6cb93a38d4ecba4e5952a9c1b87951ad20cb9734a_1280.jpg
