ID,Content_Type,Image_Type,Category,Colors,Editor_Choice,Order,Tags,Views,Downloads,Likes,Comments,URL
9467451,authentic,photo,Unknown,Unknown,Unknown,popular,"crimson rosella, parrot, bird, animal, rosella, feathers, plumage, wildlife, nature, platycercus elegans, ornithology, avian, birdwatching, red bird, wings, colourful, wild, close up",1798,1504,43,23,https://pixabay.com/get/g48e481c8442bd6d9d70f4df16604de5da7f025b6e43a2f82e9a62ca297f65e26ce59a569bd906843c0f372d4561d9839ccd5598b6362ca334a26174e0304f5fa_1280.jpg
9468324,authentic,photo,Unknown,Unknown,Unknown,popular,"sea, mist, wave, fog, water, weather, nature, ocean",1415,1247,59,15,https://pixabay.com/get/gab132eb86af92beb90d27134f9f70e47f4a845788fc41abd5f42ad6a994d65c4cbd9289c371defe1c0a1002cc1942ac2039b82868a61558b29f3df8995bdcaec_1280.jpg
9470462,authentic,photo,Unknown,Unknown,Unknown,popular,"mallard, ducks, planet, world, earth, trees, lake, river, nature, landscape",1175,996,51,26,https://pixabay.com/get/g88bce5f0146bc5b975f6a57e2a2c18acc42596def74eb6e5779aeb3f1f4795f6a9a4de99a9a5afed061b4816c6c728c1189af7a74d32f6cd1692fe7d08ae812a_1280.jpg
9468300,authentic,photo,Unknown,Unknown,Unknown,popular,"rain, nature, feet, water, wet, barefeet",1105,961,60,15,https://pixabay.com/get/gf2a4c142127500277e35147d6d8fb59202716286a1d93cf315df2fbcb8fc7b5ff790fdb15ddaa992751c37b8db6daa72d071352a539b2c56b73c1f01545f90a2_1280.jpg
9470498,authentic,photo,Unknown,Unknown,Unknown,popular,"boat, watercolor, beach, sand, ocean, nature, coast, abandoned, nautical, vessel",950,841,46,21,https://pixabay.com/get/g480a5e36880ac617ec87ec836b390c0179941a63791f417b7632b3e6ec807ea7254f5b74159b219fabb40baf0b5a486f1b647ceea5d0a6709d193338dddbd9fa_1280.jpg
9469660,authentic,photo,Unknown,Unknown,Unknown,popular,"cardinal, bird, animal, feathers, plumage, wildlife, nature, avian, beak",822,753,42,22,https://pixabay.com/get/g0f66c975d21743fa953e821cabd27d7d68ef8e80dabe1fbef06dc9b2ad7cfb00e15750b7c8c2dd6e88d0fd4df8d32c4e6d89586a56b19b5328d7aea5ffbe6b4f_1280.jpg
9469664,authentic,photo,Unknown,Unknown,Unknown,popular,"butterfly, insect, beautiful flowers, wings, flower, flower wallpaper, pollination, petals, bloom, wildlife, nature, blossom, flower background, pollinate",881,807,42,24,https://pixabay.com/get/g85bef37ef49f5975892c20c111082af3d09a0a3857ffb3ab67d1d8b1bcc8c9906af4b98fa7ce82951a28256d325dc527d30cd2562094d9dd896ba4ae599d1654_1280.jpg
9469728,authentic,photo,Unknown,Unknown,Unknown,popular,"golden temple, golden pavilion, kinkaku-ji, rokuon-ji, pavilion, golden, garden, buddhism, temple, kyoto, japanese garden, nature, japan, lake",841,779,40,16,https://pixabay.com/get/g09cd969b99dad8ebcc9545f595bedd3e2c3c9fd4e72653b37c1e2a241e7203284d15cd62a4475fae94480e75daca7cf55c02a8759d0376061aab67ece33cf05c_1280.jpg
9469658,authentic,photo,Unknown,Unknown,Unknown,popular,"butterfly, nature, insect, pollination, pollinate, garden",669,626,39,19,https://pixabay.com/get/gddd77c5e45851041120bbc64c9373ce86e39e0a167266b507dfe6f4114817af55256fb3d1cfd0bb7285e4ea7d84719cc3d408aeeb66a82cd6083758abde0d880_1280.jpg
9462913,authentic,photo,Unknown,Unknown,Unknown,popular,"mountain goat, rocks, mountain, darling, clouds, nature, animal, landscape",3403,2947,76,24,https://pixabay.com/get/g2a247b42e7683d9b2072e3b6a49c12850393372c6b6dfeb30d19d210a0e24c6317b371067decb701cd6388dafad791eb7243ae9ada272077f7805121454cf708_1280.jpg
9462909,authentic,photo,Unknown,Unknown,Unknown,popular,"mountain goat, nature, mountain, rocks, horns, lorca, city, clouds, landscape",3138,2767,71,26,https://pixabay.com/get/ge45543a8c8168b72d9a5a4d21379755b43746b968f9847b92097be5c6546a9208f40394ec9928f6792e77e38f8486ea7992033c38ac90d0d4728dff974613c86_1280.jpg
9464657,authentic,photo,Unknown,Unknown,Unknown,popular,"fashion, editorial photography, urban style, city fashion, modern portrait, street aesthetic, high-end fashion, bold statement, trendsetting look, contemporary elegance, casual sophistication, edgy style, architectural background, street-inspired, fashion-forward, dynamic pose, effortless chic, metropolitan vibe, artistic direction, minimalist fashion",5650,4251,66,9,https://pixabay.com/get/g842339ba2df8ed45c0e9601b663977a759edb303526c8811b480a1a98e4a194088749f160cbe33595ab02bfa10a8171b8ea6b3216de11f71199bbb7e14406028_1280.jpg
9469661,authentic,photo,Unknown,Unknown,Unknown,popular,"butterfly, flower, pollination, nature, insect, blossom",601,555,36,19,https://pixabay.com/get/g2a6d6b5c57d297503b3bc1c25165f3d93fb2ce366221016877709a7be0a2bcaf8d4912135c75e6dd850fdc801f3a51f2200d18092b91747f2b229f47f680c981_1280.jpg
9470460,authentic,photo,Unknown,Unknown,Unknown,popular,"planet, alien, science fiction, space craft, extraterrestrial, strange, invasion, moon, craters, design, cartoon",575,514,37,19,https://pixabay.com/get/ge2bb78501a6901b937a1e0fcfb438ffe0b424d9a6b75216d557f2316a47ac11ed08b708e2ac6081766387b49a45a37fec727ee3ee4952d4900c4a845d36d5f49_1280.jpg
9469714,authentic,photo,Unknown,Unknown,Unknown,popular,"golden pavilion, golden temple, kinkaku-ji, kyoto, architecture, temple, japanese, buddhism, rokuon-ji, to travel, kinkakuji, golden, japan",610,577,33,11,https://pixabay.com/get/g7a4bec6c434f22741a2d2ff0f60db1c78c7f9f5dc38991918cd22d26104f72fe0d20f4b4b23547f86c74f01f8da48b54f29e3ad5f1c1e704c0ccd7da22b03f22_1280.jpg
9469712,authentic,photo,Unknown,Unknown,Unknown,popular,"golden pavilion, pavilion, nature, building, lake, temple, golden temple, kinkaku-ji, kyoto, architecture, tradition, japanese, traditional, garden, tourism, buddhist, japan",782,720,34,16,https://pixabay.com/get/gd33b771d3f314553ad61a916d1f2c80f8cf0b0aa629620bdd9a15b1261baf663335d18f89d5fc8cca802eaef0304dbddb9842756dec9aa3f91a038f08b772ad6_1280.jpg
9469666,authentic,photo,Unknown,Unknown,Unknown,popular,"butterfly, flowers, pollination, nature, insect, pollinate, summer, garden",489,463,33,18,https://pixabay.com/get/g65c24fe4c2aa340a63ab57d1ef84c5c8c68041571f7d8c9e13ae061699be43e92ccf3e8ab4a02f1a703f3f763cf5d78ad7f636135e242390559abef6765deacb_1280.jpg
9468025,authentic,photo,Unknown,Unknown,Unknown,popular,"robin, bird, animal, feathers, plumage, wildlife, nature, winter, songbird, ornithology, bird watching, sitting, close up, branch",647,603,29,8,https://pixabay.com/get/g3e8ea4dab1facccb9842506173a2f40f698bbb9d50d142578b416ad581c210ede9d8c21ab40f124b6423fe80ad5d3f05fbdce2cf7543054c84e62f0191ee2eca_1280.jpg
9470470,authentic,photo,Unknown,Unknown,Unknown,popular,"pattern, feet, barefoot, toes, pedicure, design, nails, polish, cuticles",393,354,34,18,https://pixabay.com/get/gd69e4201cc5ffacaf8d12de9e6f6402b542a5f9a5fe27ab8148cc71c9aa956b2019d8ff9dcec0ca60b1b9569d58cc8c27670fd9f9c4616213e70ef76b18dc0a8_1280.jpg
9455144,authentic,photo,Unknown,Unknown,Unknown,popular,"sea, boat, clouds, landscape, sunset, nature, horizon",6915,6028,97,33,https://pixabay.com/get/g74bd335b58bf3a10ea70785e937cadb47e7d07548a97598f86051f2d138a62f2a90d82a7cc7c7855315316568bb7e12dd11436713d8da5cf191ccc534064a7f5_1280.jpg
9470323,authentic,photo,Unknown,Unknown,Unknown,popular,"blue tit, nature, bird, winter, wildlife, ornithology, bird watching, sunny, perched",437,404,29,7,https://pixabay.com/get/gb2e6bef845f0bff94fdf1e2379a299763331a26fc10d8028440a1cd2bdbbc68ea0997b9c7ee7cdb58b9df1b51f57075dc8ca8d00156bbeb5a1148144865e1d34_1280.jpg
9470315,authentic,photo,Unknown,Unknown,Unknown,popular,"nuthatch, feed, winter, bird, nature, wildlife, ornithology, forest, animal",445,414,28,7,https://pixabay.com/get/g54ee08c118ac4374c2e96f4bfbb7deae9e2c116d3bc4ded537e5705053d962941a0587996605423b8b1e74ce219f1615cd678123836457444b849dc77e0f5141_1280.jpg
9472510,authentic,photo,Unknown,Unknown,Unknown,popular,"flower, laptop wallpaper, flower wallpaper, wallpaper hd, floral background, hd wallpaper, beautiful nature, wallpaper 4k, 4k wallpaper, rudbeckia, beautiful wallpaper, full hd wallpaper, mac wallpaper, echinacea, 4k wallpaper 1920x1080, angiosperms, orange flowers, asteraceae, beautiful flowers, goes away, cool backgrounds, flora, windows wallpaper, botany, plants, garden, desktop backgrounds, free wallpaper, close up, nature wallpaper, colorful, nature background, nature, free background, flower background, wallpaper, coneflowers, cereal, leaves",292,254,27,13,https://pixabay.com/get/gccb74bf92974c3b097f20fd1dd628a740284a6a897dd88df8170a663f436a1dde08ba88d0e8d4e1cb98b6ca1245ed4068de20a92d48b2849fd792dfa95c6091c_1280.jpg
9469312,authentic,photo,Unknown,Unknown,Unknown,popular,"willow catkin, blossoms, plant, pasture, nature, blossom kitten, stamens, furry, seeds, spring",329,286,31,12,https://pixabay.com/get/g671ff4e3942fc1c1b66b283654f99d684f1891cb9c85bb6f7645bc930316e0cc26be1737318727c3482e6b5036067a3ce685859af7339f5670e117dd44ec9caa_1280.jpg
9469713,authentic,photo,Unknown,Unknown,Unknown,popular,"blossoms, flower background, flowers, shrub, beautiful wallpaper, plant, petals, bloom, nature, bush, beautiful flowers, floral background, garden, flower wallpaper, branch, temple, background",609,562,30,10,https://pixabay.com/get/g6061a7385a8faf7b30dfdc21ecde34811dad5df8a1dcccb4daa9c0d8d51af0fefffc064d67fbb93f5cdeaac18d0bf69b477d96143e3bcefe94c3696ab8cd9a1d_1280.jpg
9466638,authentic,photo,Unknown,Unknown,Unknown,popular,"laughing kookaburra, kookaburra, bird, dacelo novaeguineae, animal, feathers, plumage, wildlife, nature, beak, avian, bill, perched, tree, birdwatching, ornithology",429,398,30,18,https://pixabay.com/get/ge6692996ca0c695f3f2f9c4c3935abf223da7063873def8d7fd33fed84489fd8b87d8381b834b34492b26be814f82bc83982b5acec6d2abfcb44840aeb18fb46_1280.jpg
9465102,authentic,photo,Unknown,Unknown,Unknown,popular,"lupine, flower, dew drops, drip, botany, flower background, bloom, flower wallpaper, garden, nature, plants, flora, blooming, gardening, beautiful flowers, spring, has blossomed, in bloom, close up, botanical garden, pink",1661,1553,39,28,https://pixabay.com/get/g67b710048121d01714af378f7de6d66a082462ef95b432a7033f7e1e5c032da7bba73760f6ab29035053ccdc0089eae2bdcab88355f173b1218cf36a06e68dcb_1280.jpg
9465133,authentic,photo,Unknown,Unknown,Unknown,popular,"flowers, bell, dalmatian bells, ringtones, purple flowers, nature, flora, close up, garden, bellflower, decoration, composites, campanula, purple, violet, bloom, decorative flowers, dangling",1545,1404,40,31,https://pixabay.com/get/g0130faeddc74c96f3cb5acf27b0d57766a744c8cea5a2312750fcdb3e1028f1aeae9b67e5a164f673ead7d80d153ba24e458c9d42ca9402d2da21e27dd73737a_1280.jpg
9453063,authentic,photo,Unknown,Unknown,Unknown,popular,"flower, flower wallpaper, herb, beautiful flowers, floral background, botanical, nature, macro, flower background, beautiful wallpaper, pollen, garden, background",9502,8177,87,11,https://pixabay.com/get/g1d78d92686f959ec606fea6557ba6329fa97faa635fcce8ba915c7357f664df36b42383e2a7c3b923527a4e947b3af263b9959e062a942aeeec9d83f56848dd5_1280.jpg
9472262,authentic,photo,Unknown,Unknown,Unknown,popular,"beach, wallpaper hd, sand, laptop wallpaper, free wallpaper, nature background, tide, wallpaper 4k, low tide, 4k wallpaper 1920x1080, cove, sea, ocean, beautiful wallpaper, cool backgrounds, mac wallpaper, hd wallpaper, roche, pink granite coast, free background, nature reserve, windows wallpaper, beautiful nature, nature, desktop backgrounds, landscape, nature wallpaper, wallpaper, desktop picture, 4k wallpaper, full hd wallpaper, hintergrundsbild, yk",521,478,26,14,https://pixabay.com/get/gb212e4507f990f34a080f617cdae74d624aa949139396ec98d6a3f6b911212c306fd26f482b2196474b3d66d6edbea7e677401a40e8a259792d5f42112ab9990_1280.jpg
9472180,authentic,photo,Unknown,Unknown,Unknown,popular,"boat, fishing, sea, windows wallpaper, ocean, cliff, laptop wallpaper, rocks, nature wallpaper, 4k wallpaper 1920x1080, hd wallpaper, fisherman, beautiful wallpaper, nature background, nature, wallpaper hd, free wallpaper, 4k wallpaper, wallpaper, free background, desktop backgrounds, cool backgrounds, wallpaper 4k, desktop picture, mac wallpaper, hintergrundsbild, beautiful nature, full hd wallpaper, yk",475,431,25,11,https://pixabay.com/get/g6700848e05080d1bc39bdbf3a357521097d00b793f5f105579e0518f5c0378963f1654ec241a4918747dc01a51641e483723dbc89fec1b663745dcade3dbb69f_1280.jpg
9470838,authentic,photo,Unknown,Unknown,Unknown,popular,"tulip, pink, flower, flower background, nature, blossom, bloom, beautiful flowers, spring blossom, flower wallpaper, black background",583,550,18,13,https://pixabay.com/get/ge098c98c2bb607a3ce44cd2b869951c04501b04311919c4fc4a3e192f191c1fb18b8ad78195fe416f5ca1e0815c45097fb797d5cf95e0180b53be65a4734ad14_1280.jpg
9468024,authentic,photo,Unknown,Unknown,Unknown,popular,"great tit, tit, bird, animal, feathers, plumage, wildlife, nature, songbird, ornithology, sitting, beak, bird watching, foraging",334,313,23,3,https://pixabay.com/get/g430faa582312fa2f8573e771b52d6e87148139bfd6b3e31e016427277f524e84774dce23cdbfaea181a1f845f46320896c86cc11e3e572aeaef0951ce4426bb0_1280.jpg
9467187,authentic,photo,Unknown,Unknown,Unknown,popular,"canada goose, nature, geese, animal, goose, waterfowl, wild goose, pond, asleep, wildlife, bird",352,321,26,9,https://pixabay.com/get/g5fa024a94e9671d7eda90d904b104ebb4eef279796c3a36881a2ecd3450cb7e60c9602accc0c74ae6df0dafd52c0dbc7178f4b4fbd3e8397cacd23ca588f413e_1280.jpg
9472181,authentic,photo,Unknown,Unknown,Unknown,popular,"boat, full hd wallpaper, nature background, veil, free wallpaper, 4k wallpaper 1920x1080, nature wallpaper, leisure, sea, beautiful wallpaper, cool backgrounds, ocean, rocks, beautiful nature, hd wallpaper, 4k wallpaper, wallpaper hd, mac wallpaper, laptop wallpaper, wallpaper 4k, windows wallpaper, free background, desktop backgrounds, nature, wallpaper, desktop picture, hintergrundsbild, yk",430,392,25,14,https://pixabay.com/get/g2e993d0978e84afb81686eff49e7aef0499764623757cf8b4920ed4a8f246369bd78a7dbead70824a82e54571a0e7ceaf753554fabc48e6f8a331d99d975aae0_1280.jpg
9471777,authentic,photo,Unknown,Unknown,Unknown,popular,"aries, rabbits, cuddle, domestic animal, animal, nature, rabbit",346,308,25,11,https://pixabay.com/get/gcfd30d99baaa3c02e1d19ea5e3b3de16897d0600d3cd7d4bd01367003cb7119e336dc06695c1945e7bfd334b6539afe6d70488c9d878f45c864f0b7e42acef47_1280.jpg
9468691,authentic,photo,Unknown,Unknown,Unknown,popular,"sheltie, dog, animal, mammal, canine, domestic, pet, nature, blue eyed female dog",317,279,26,14,https://pixabay.com/get/g49bd209475f7590527a4496b65b2d1fc3587cb7817d7a7ffc0e265f33fe49e1f6e9cd04bfad9a9729297ec75460633536828f1e0ed9aa12e0c2dda5a9b7ed783_1280.jpg
9455145,authentic,photo,Unknown,Unknown,Unknown,popular,"wolves, animals, winter, landscape, snow, forest, trees, cold, nature",4647,4177,80,23,https://pixabay.com/get/g27c71556a3ef71d54f26b13718c899d1423c523dc12d908d9fa5000906f40c82b1917f8276e35a7772789f6c86da05edb3c4d13ddb34604f28d6d9a24b09131f_1280.jpg
9468022,authentic,photo,Unknown,Unknown,Unknown,popular,"great spotted woodpecker, woodpecker, bird, animal, feathers, plumage, wildlife, nature, beak, bird watching, ornithology, sitting",337,314,24,5,https://pixabay.com/get/gc90489ca18b3538c939b51932349b78982f4798789fb61af3b3e6de3c4fb4acc10645def97c814201d2556e2d028f1f1b442126271add71865ee3563a1c5cab5_1280.jpg
9462733,authentic,photo,Unknown,Unknown,Unknown,popular,"mountain, mountain goat, horns, jump, rocks, clouds, hiking, nature, landscape",2322,2140,63,19,https://pixabay.com/get/ge6ad27082035517e58b717247cee1586bbd857d607eb52f976cb60176079c2417e2eb71ecf701f41541cea05a37d33e8c73add9533fc72d1c89ba680f9b680b7_1280.jpg
9462732,authentic,photo,Unknown,Unknown,Unknown,popular,"mountain, forest, pine, nature, hiking, landscape",1777,1635,59,16,https://pixabay.com/get/gf3e17b2504b6b6d0edc1229fab3d582cd3029b32eb5f8622a5814398d93d75e8c6f709819d7484232893446fe5410f2e8c07f27caf0eda714f0000e2e15edfef_1280.jpg
9467534,authentic,photo,Unknown,Unknown,Unknown,popular,"fall, leaf, autumn, spring, wilted, nature, light, forest",237,221,17,0,https://pixabay.com/get/g8d75933fd887511d478bdd2e38171de3a5d7733fcc2e79a0123fd216326fb8c3844e2a46177269018c704d54385cf430e704adb01d1a0536c4cef81f0bfd2fa8_1280.jpg
9465687,authentic,photo,Unknown,Unknown,Unknown,popular,"lighthouse, lighthouse mean ruz, ploumanac'h lighthouse, rocks, granite, pink granite coast, littoral, nature reserve, ocean, sea, low tide, nature, landscape, trail, customs footpath, path, moor, coastal moors, bridge, panorama, banner, header, yk",1147,1092,35,16,https://pixabay.com/get/g7409c48ec969f48ed40feb5fe2ef5da128b8e6535cd76896a7a0c40acd8354e71382099f2efd31e9a5330300c7081a5d3f71485a5607bfc9595719c91e5a08c6_1280.jpg
9472268,authentic,photo,Unknown,Unknown,Unknown,popular,"beach, tide, low tide, sand, cove, sea, ocean, nature, rock, pink granite coast, littoral, nature reserve, landscape, panorama, banner, header, yk",361,336,20,13,https://pixabay.com/get/g031010688702d49b2bd01532857d9d14ebf83723a8d34044c843fcc264f2b677de821659c6a095c56ca1198fec4380b83d0809d24a07cbfe4ae88fb7bf255d17_1280.jpg
9472511,authentic,photo,Unknown,Unknown,Unknown,popular,"sparrow, bird, nature, animal, wildlife, fauna",133,120,19,6,https://pixabay.com/get/g1f57fd09bbf81baad1b1623dad523c4ce58d5aee45af0a7b4fa6b8a4266fbbfc4b8c6fc6f9a45f36796e115ab089fe133a8da4b9b4601adc04a41364ca035dc5_1280.jpg
9465645,authentic,photo,Unknown,Unknown,Unknown,popular,"lighthouse, lighthouse mean ruz, wallpaper hd, ploumanac'h lighthouse, rocks, granite, pink granite coast, littoral, free wallpaper, free background, 4k wallpaper, laptop wallpaper, nature reserve, ocean, wallpaper 4k, beautiful nature, hd wallpaper, full hd wallpaper, sea, low tide, nature, nature background, landscape, cool backgrounds, trail, 4k wallpaper 1920x1080, customs footpath, path, moor, coastal moors, beautiful wallpaper, nature wallpaper, wallpaper, desktop picture, mac wallpaper, desktop backgrounds, windows wallpaper, hintergrundsbild, yk",1135,1074,34,18,https://pixabay.com/get/gb08a3239843693214ee004792a286baad7dd7fed911799d2046b12a57bb040db0b0fbf5f0e7d044d6af8fc72631ddddd580b5a4efb4bbe92766f9223dcd73dae_1280.jpg
9456877,authentic,photo,Unknown,Unknown,Unknown,popular,"sunrise, morning mood, nature, morning sky, mood, the atmosphere, lake, reed, grass, lake landscape, water",2976,2789,51,24,https://pixabay.com/get/g77868f2c37cf62b4d438dfe290687f52ae57b6b4eae2fa908c377e776650b56e2107daa59c824303fea9e06dddd28aa1af2d57ec2178b24cb9594f28f0aae640_1280.jpg
9456864,authentic,photo,Unknown,Unknown,Unknown,popular,"sunrise, morning mood, dawn, the atmosphere, in the morning, morning sky, mood, boathouse, lake, landscape, water, nature, outdoors, web, upper bavaria",2506,2327,55,22,https://pixabay.com/get/g5759784b3be0e5d5a3ba1ee44453f0fb970bbedd5252d556703816730f3a59b01cfbcbca48f0e7d62f8e2616f9c4fc52f67b1a2a1af460b84b6a844724df31b2_1280.jpg
9456871,authentic,photo,Unknown,Unknown,Unknown,popular,"sunrise, morning sky, morning mood, dawn, mood, sunlight, morning sun, boathouse, web, jetty, wallpaper 4k, water, mac wallpaper, mooring, upper bavaria, cool backgrounds, 4k wallpaper 1920x1080, nature, free wallpaper, background, windows wallpaper, free background, laptop wallpaper, full hd wallpaper, 4k wallpaper, wallpaper hd, hd wallpaper, beautiful wallpaper, desktop backgrounds",3458,3203,52,24,https://pixabay.com/get/g4a7ca9b4425ba5e8740c8bc219cfe955e2a769ed6f341f462ed0b37cf252095feca1c7bf8219bc4d85c72166f2e66dbbeba41df2673e8aca8ff2b297ddeb61d7_1280.jpg
9465649,authentic,photo,Unknown,Unknown,Unknown,popular,"lighthouse, mac wallpaper, full hd wallpaper, hd wallpaper, lighthouse mean ruz, wallpaper 4k, ploumanac'h lighthouse, desktop backgrounds, rocks, wallpaper hd, granite, pink granite coast, littoral, cool backgrounds, nature reserve, windows wallpaper, ocean, sea, 4k wallpaper, free background, low tide, nature background, laptop wallpaper, nature, landscape, trail, customs footpath, nature wallpaper, beautiful wallpaper, beautiful nature, 4k wallpaper 1920x1080, path, moor, free wallpaper, coastal moors, wallpaper, desktop picture, yk",1007,956,33,15,https://pixabay.com/get/g920349b3e6f2b78afe2c74ee240a7b2c17c5ed1fed85ba02474ddbf46d97815a9cc637118b596f2a3ec7a0e70d50d25bbfe259d4cceb79c3e63616674fe9d7a0_1280.jpg
9457415,authentic,photo,Unknown,Unknown,Unknown,popular,"rose, flower, hd wallpaper, plant, red rose, red flower, petals, bloom, garden, flora, nature, closeup, wallpaper",3203,3018,46,32,https://pixabay.com/get/ge30f07619e5915cd09b512a2964dc1ce150666a097147c35716fb20eccafc5610de60a5cdeb9fa4c63096ac25c6ce711102d77e9520fb1a3930d6064334d7d78_1280.jpg
9449133,authentic,photo,Unknown,Unknown,Unknown,popular,"desert, sunset, dunes, sand, dromedary, clouds, nature, landscape",5757,5293,89,25,https://pixabay.com/get/g4e6ae493a106da57d15c231299464eb563ea2b06e317198991af924fee7caf1f80f02139927874692d0de41293604d22fedadf3ea469e489ca62f1d84b5924e8_1280.jpg
9471779,authentic,photo,Unknown,Unknown,Unknown,popular,"rabbits, rabbit, animal, cuddle, domestic animal, nature, aries",256,241,21,5,https://pixabay.com/get/gca7401e2345015db6218ece2f3910085fdba6a8dacfffc2dd810857ba8f699eb4d73d9d41caab1ef5aaf2e83ca2a7b673308aebb4d6f2ff00d12c46766e66d11_1280.jpg
9465652,authentic,photo,Unknown,Unknown,Unknown,popular,"lighthouse, lighthouse mean ruz, wallpaper hd, desktop backgrounds, ploumanac'h lighthouse, hd wallpaper, rocks, mac wallpaper, granite, nature background, pink granite coast, free wallpaper, beautiful wallpaper, full hd wallpaper, littoral, nature reserve, nature wallpaper, ocean, sea, windows wallpaper, low tide, nature, landscape, trail, customs footpath, 4k wallpaper, 4k wallpaper 1920x1080, path, free background, cool backgrounds, moor, coastal moors, beautiful nature, wallpaper 4k, wallpaper, laptop wallpaper, desktop picture, hintergrundsbild, yk",875,825,31,13,https://pixabay.com/get/g7071e7d9b458e55b6f94636704b95a0e34848c7bcd968ccf4f774b3314502f96b940d4157e48160d4b7f88cfbd6fad52efcd2bb7cd3712726c49b5da19661499_1280.jpg
9465723,authentic,photo,Unknown,Unknown,Unknown,popular,"common poppy, beautiful wallpaper, poppy, 4k wallpaper 1920x1080, wallpaper 4k, free background, seed pod, seeds, macro, close up, cool backgrounds, windows wallpaper, beautiful nature, summer, dried, nature, desktop backgrounds, nature background, hd wallpaper, background, nature wallpaper, wallpaper hd, free wallpaper, full hd wallpaper, hd background, 4k wallpaper, laptop wallpaper, mac wallpaper",964,913,28,14,https://pixabay.com/get/g255474e7c9ab8656ddd69e71c955086474433e209f0cfb718515554638d2e2735df9055e516caed5d7b6756720b32de2d5319b623dbca7439671f34d4f7a76e3_1280.jpg
9456867,authentic,photo,Unknown,Unknown,Unknown,popular,"sunrise, morning mood, dawn, mood, the atmosphere, morning sky, in the morning, nature, morning light, lake, light, reed, lake landscape, upper bavaria",2258,2148,48,24,https://pixabay.com/get/g62d1b8860c1e29bca9b7c3ca352888113944a129f08ae4f858b7e2e3fa2629f8878e50e5c6f89e0cbbd2dc1561681a17efc1077cc128679bab2fcd22c0adcdeb_1280.jpg
9471778,authentic,photo,Unknown,Unknown,Unknown,popular,"rabbits, rabbit, animal, cuddle, domestic animal, nature, aries",224,206,20,8,https://pixabay.com/get/gfb4065e15351c16cf4be6db8929cb59dd9ca1b686f55e6f31a77737bdf698974f74ab721714766d5e321f13be1a3a52ae3b290a2c1c2239cb50fc8617df25fb3_1280.jpg
9446771,authentic,photo,Unknown,Unknown,Unknown,popular,"bird, night, branches, darling, nature, pens, animal, plumage",5346,4843,94,24,https://pixabay.com/get/g8ede294e6600dc44061378de26d020bbd43ffc79b137ca1f623b46163658dd47f6c0c8cbe1e9ee024eb85ff61619297e4b0c65cdd0697efb48660108b725fca1_1280.jpg
9460131,authentic,photo,Unknown,Unknown,Unknown,popular,"lichen, tree branch, organism, algae, fungi, growth, broken branch, tree, plant, fruit, nature, organic, peaches",1379,1297,43,21,https://pixabay.com/get/g4271b62b3145e1a000cf9d29e9bb13e3a76499f652d69601d4c09ea498fea4e506be9e4d8bcc8b0c5ae356a21d32471fb47183ff54f2521f410845ce7b7a799d_1280.jpg
9467188,authentic,photo,Unknown,Unknown,Unknown,popular,"goat, mammal, animal, ruminant, horned, nature, farm animal, horns, graze, wildlife",234,206,20,7,https://pixabay.com/get/gb5ae1db822d88c101477e8a89d91463dc5bc5e42cdaafd2eb6aba0066dfc9435e8c570ee23657bca67745835ca89e29264efcbf6ab5358059c16c7e133f67b35_1280.jpg
9473452,authentic,photo,Unknown,Unknown,Unknown,popular,"oriental hellebore, billy rose, spring christmas rose, helleborus orientalis, early bloomer, petals, stamens, beautiful flowers",173,144,19,6,https://pixabay.com/get/ga8b833de25269b1c14bc67afacb3cbc485a9bf43692e6b58cbe1eeeb25ac6fc476aec9cb9ce4eb14eb25e2ed142a181484656a5404ffc4791e208393f78e491d_1280.jpg
1869902,authentic,photo,Unknown,Unknown,Unknown,popular,"christmas background, christmas, christmas tree, presents, gifts, boxes, gift boxes, christmas presents, christmas gifts, decoration, xmas, christmas wallpaper",1490890,873707,1693,424,https://pixabay.com/get/gd673a6b17d4bcd70f279a33bfdf8dd32dbf71799c63f264319af00808f7fe465beefa1563ba6c719a61060d78594fe685414937f93cd2406a08d80014178379d_1280.jpg
9457413,authentic,photo,Unknown,Unknown,Unknown,popular,"lily, flower, plant, petals, bloom, blossom, nature, botany, beautiful flowers, flower background, growth, macro, stamen, flora, close up, garden, flower wallpaper, lilies, orange lilies, orange flower",2318,2200,47,25,https://pixabay.com/get/gcf4bfaffbd09aa9efc0dc81561ba7039085518fd845407357ed0efe5fa8708dfb4e203c09734e652e6a9aed22feacbb2360c3220903b5743ee1d58a6d9f4f59c_1280.jpg
9457410,authentic,photo,Unknown,Unknown,Unknown,popular,"lily, flower, plant, yellow flower, daylily, petals, bloom, lilium, blossom, nature, wallpaper, stamen, hd wallpaper, botany, flora",2123,2033,44,28,https://pixabay.com/get/g1cb97276ee1370dc4fc45f70a85893bef12f1a7a3c453abf3878ae476691fd8086a70b528aaca0c5621cd36d7890cb59151ed7047571eb5361b7c8c4794cb203_1280.jpg
