ID,Content_Type,Image_Type,Category,Colors,Editor_Choice,Order,Tags,Views,Downloads,Likes,Comments,URL
7573678,ai,photo,Unknown,Unknown,Unknown,popular,"ai generated, tropical, jungle, waterfall, water, river, nature, trees, forest, palm trees, jungle, jungle, jungle, jungle, jungle",6150,3856,74,2,https://pixabay.com/get/g0f8abbf48a769de23c255b6efc21e24af0e476b87c4986ed53cdb3a12c4d0aad896b89427a7a442e9eedf6ecaa57be15e3c51c09195cff66a3cb61540822dc2d_1280.jpg
8342848,ai,photo,Unknown,Unknown,Unknown,popular,"ai generated, woman, face, hair, young, autumn, person, nature, teenager, window, beauty",539,410,13,0,https://pixabay.com/get/g8a8f3f0cd34218ab26084c63b539ae0e9d771c16122f1067c80a5477ed19e2fb504148f5b4d9a68c40d955cf327dca7fefd13bd09d81d3d58ca4d4ce564a1c45_1280.jpg
7459769,ai,photo,Unknown,Unknown,Unknown,popular,"trees, mountains, river, water, wet, landscape, vista, nature, ai generated",600,516,3,0,https://pixabay.com/get/ga04ee28ab6352f4419af2367e2478b4f62f7e63f4ef09fa436cc206559bf72181e7f93e23bf0fc57a7b139eac7bb6f845a0a1bad12e13b5e70c6ebe69d5b0722_1280.jpg
9116585,ai,photo,Unknown,Unknown,Unknown,popular,"ai generated, leopard, jaguar, wildcat, animal, wildlife, wild, wilderness, jungle, portrait, nature",3536,3420,16,0,https://pixabay.com/get/g452244c449d4422e5babdcfc8d09318a48f5cb0170671341e38a0c88d9e663c946c55b40ccd4f355102e6891b487fa3f5dd249e8ab0d44d12ce16c20d36530bf_1280.jpg
7611787,ai,photo,Unknown,Unknown,Unknown,popular,"rocks, trees, mountains, fog, sunset, paradise, fantasy, ai generated, nature, landscape",316,218,12,0,https://pixabay.com/get/g5a8e5b00a7ad615e0d7aea3d2b95ce74cc20844144945d8290742e777a24e46faad5d5fd3d3430ec8f99e73905bf604016198c7a20cafc0d9814c98ae1ce1c4a_1280.jpg
7871783,ai,photo,Unknown,Unknown,Unknown,popular,"amphibian, chameleon, nature, animal, africa, madagascar, wildlife, conservation, ai generated",2695,2536,17,4,https://pixabay.com/get/g5f6c84364e5c3aa201469ea3a12694b40018f24d649b41a78291329675b6280f2aa890000ad170c23f8fa659e19c993fe92af89120597490b62400a6fd79491b_1280.jpg
7611697,ai,photo,Unknown,Unknown,Unknown,popular,"forest, river, jungle, ai generated, nature, fantasy, landscape, mountains, sun, sunrise, water",626,315,14,0,https://pixabay.com/get/gfd08c1439f87176a90c9086961554754f50853825dacaefe0b01d70fb16e5693b2edc8a2bd767a294a061ee49e76291e41f1731e4e11b77ca1d61c59739f5f32_1280.jpg
7935610,ai,photo,Unknown,Unknown,Unknown,popular,"ai generated, office, team, collaboration, work, laptop, desk, workplace, office, office, office, office, office, workplace",8813,6494,15,1,https://pixabay.com/get/g78d5b1ac9956323c4ac610460dbb092d532be559ae80df669a9d97c78c3f4752a0e6c9346a810b51e8eb2d5e890233d578c8c72a19c5060ebf47ff7d6817126a_1280.jpg
7987329,ai,photo,Unknown,Unknown,Unknown,popular,"ai generated, rice, dining, restaurant, creative, food, seafood",414,329,5,0,https://pixabay.com/get/g2bcc9a3df32450c79778cbb8dc698e43af5edff26739d489e8ad69d725d5f18625d68ff406285c9f870d82a382d6dde9295360934ff6fea84f03fb917dc56581_1280.jpg
8080064,ai,photo,Unknown,Unknown,Unknown,popular,"ai generated, cat, mammal, animal, pet, feline, domestic cat, model, nature, portrait",1618,1526,7,0,https://pixabay.com/get/g04f2e87c4fc6c41b7225ffa3a5cabc5a98f5a25960c562094b93251f05bc5f19cf5f80659ec504c37ba494b7575057eca0d05dfa123e28132dd72909895ee9e1_1280.jpg
7771733,ai,photo,Unknown,Unknown,Unknown,popular,"ai generated, mountain, people, sky, adventure, hiking, dawn, destination, nature, outdoor",1001,838,6,0,https://pixabay.com/get/g26ba7d8b83cad8e405e823b05e61fea146cb15d15955fc97df86d1022c12b1123dc4421964094e857c6073f85313ecd22b3f75ff0fced1e9cfdc6cfd58547a57_1280.jpg
8170513,ai,photo,Unknown,Unknown,Unknown,popular,"ai generated, man, elegant, stylish, modern, office, posing, model, business, portrait",264,201,2,1,https://pixabay.com/get/gc7bb3ae188de2ecca9b356bd45316ec055572c936dbff54a7ab256ffd29373bb0ebd12e166e4083449ce1d6cb00b87b85e9f7ac3fb2bbe8a6f7648ca814946a1_1280.jpg
7738795,ai,photo,Unknown,Unknown,Unknown,popular,"ai generated, black ariel, woman, portrait, 3d render, black woman, beauty",5027,4628,23,1,https://pixabay.com/get/gc9c1953243ab1063beb068268c7cc508d4eff02aeeb11ae70c52473108cacef05dba399804b01ced18770eb62b7e1e40bf1a72667566886e288514a8222f7c0f_1280.jfif
7937832,ai,photo,Unknown,Unknown,Unknown,popular,"vegetables, cucumber, nutrition, fruit, food, kitchen, organic, harvest, ai generated, cucumber, cucumber, cucumber, cucumber, cucumber",3822,3347,11,1,https://pixabay.com/get/g111d971394db0a215721490af00dfc037d1c770c447522b344f02e1e2deb8812baf6bbeac23f20b414f4b5e03aefa4301aa5eb17a6430a9f6ff6ed6f9f2c9932_1280.jpg
7500012,ai,photo,Unknown,Unknown,Unknown,popular,"ai generated, winter, snow, trees, forest, fantasy, nature, landscape, season, outdoors, woods",283,162,9,0,https://pixabay.com/get/g61431b1bd9105f8e5f97c03cef591e0d83a19a512dcb46375e8b6341a6713dab292259248897b7da380d87cc4781e3dc082648c0a5856bd8f5ebaf066b146d59_1280.jpg
8675021,ai,illustration,Unknown,Unknown,Unknown,popular,"ai generated, ice cubes, mint, green, refreshment, cold, close-up, ai generated, ai generated, ai generated, ai generated, ai generated",56995,36054,426,51,https://pixabay.com/get/g3abc33a927a18b23d9daf39ce88de2b980cb7dbf0eb56d11bd714a9375c88b39eaea946fbdd6cb1d93864b32cb1f62fe1e1eb6a078df0479c3ae1955b2adb866_1280.png
8491587,ai,illustration,Unknown,Unknown,Unknown,popular,"ai generated, black, woman, industrial, curly hair, portrait, ai generated, ai generated, ai generated, ai generated, ai generated",21890,9789,171,9,https://pixabay.com/get/g8a29c05ecd17f60773554b0024745974e972cd8eb2396937700df84aae2d94355b073c0d0ce80e1be963e85f7b6f43fdf8cdf98ae781aa8e0de9a928b51b5d4f_1280.jpg
8463482,ai,illustration,Unknown,Unknown,Unknown,popular,"ai generated, hearts, diamonds, purple hearts, violet, purple, lavender, ai generated, ai generated, ai generated, ai generated, ai generated, purple",28790,16233,366,15,https://pixabay.com/get/g5f7a3f3c52479c433e873cfe338c4afb7056936e142005b2844d30f88b1df04bb4d26334fc6406dd818753c9378731419e080c1630091555636b28ffe91297b2_1280.jpg
8698024,ai,illustration,Unknown,Unknown,Unknown,popular,"ai generated, woman, warrior, female, red hair, sword, fighter, rpg, character, ai generated, ai generated, ai generated, ai generated, ai generated",21816,9213,148,4,https://pixabay.com/get/g886f732a998d9a567564e2063532ac4c6799fbdbe70020c054680f69278b619c9b739028891f3c0c47c3ff76a3926c337ebbf4e04d034c480572498527d502bd_1280.jpg
8274116,ai,illustration,Unknown,Unknown,Unknown,popular,"ai generated, lizard, reptile, animal, pastel, pink, ai generated, ai generated, nature, ai generated, ai generated, ai generated",34336,15858,360,34,https://pixabay.com/get/g0f31b889687b085ef2c76dc21540f4c3f26e2efb7ce633973475cd308ced2840db953b6f46039771af64ba70bd3577fdaf92284cf8c4a3b0d80b9011b272e69e_1280.png
8612487,ai,illustration,Unknown,Unknown,Unknown,popular,"ai generated, japan, lake, mountain, tree, pink, moon, night, nature, ai generated, ai generated, ai generated, ai generated, ai generated",65948,35850,440,41,https://pixabay.com/get/gc32d74e2ec35a011fc0305e8bfea0e6e64188fdc5f4c4dcdf7dbfed11cdb8b585a53cebe561274cb8e5c2c0f1307680c43c4fd1184740326d7d8b6821ce8cb3c_1280.jpg
8470716,ai,illustration,Unknown,Unknown,Unknown,popular,"ai generated, red hair, ginger, blinds, window, lighting, portrait, woman, ai generated, ai generated, ai generated, ai generated, ai generated, portrait",27643,11997,303,22,https://pixabay.com/get/g423747f3f7b5dbe2a438a6a115ad52606024e0163e8e37d7a8f9102ef8172b6365002c6c1561c57f31a20ada81795389edba871f6256491d985f27ddff23d504_1280.png
8464364,ai,illustration,Unknown,Unknown,Unknown,popular,"ai generated, water, drop, blue, high speed, background, ai generated, ai generated, ai generated, ai generated, ai generated, nature, water",34390,18386,254,15,https://pixabay.com/get/ga4078b80e1d95e1d7fcb26fbee6b3281a6c4003ecef7658c3e6061fdec15d093c883a05e441f4695ea4be1076420b3e575d25d9f9fd0d52ee06c5a6fbed5c0f0_1280.jpg
8637800,ai,illustration,Unknown,Unknown,Unknown,popular,"ai generated, orange, chick, bird, fruit, citrus, nature, ornithology, avian, nutrition, vitamins, organic, ai generated, ai generated, ai generated, ai generated, ai generated",32561,13054,240,22,https://pixabay.com/get/gfc29685481d568c7f13e83d5b04f22ab21fdffdffcaf2e37806986c5e28aeb8a3db17532bb88f89c43f6ac5df0466410689d5d94d1662f92f916fc3d4fb244d7_1280.jpg
8498741,ai,illustration,Unknown,Unknown,Unknown,popular,"ai generated, tsunami, sea, wave, destruction, nature, ai generated, ai generated, ai generated, ai generated, ai generated, tsunami, tsunami, wave",21611,12815,139,10,https://pixabay.com/get/g6b04072f4e9c68a6803f767d74a703ed5a0e2cf080c517a412abbda1d8e89020465617d25fa0ad0721a5e0fce99b7844d6affd921e099e5283246c193a271e64_1280.jpg
8630058,ai,illustration,Unknown,Unknown,Unknown,popular,"ai generated, woman, jungle, nature, forest, leaves, rainforest, green, rain, tropical, model, girl, portrait, female, ai generated, ai generated, ai generated, ai generated, ai generated, rainforest, girl",24430,13387,262,21,https://pixabay.com/get/gd4812c2ee91daf17ee85d43fb401263bf2a1102de4c5bf0b8fbfba8566d0842676d745871ce0ca5bf54c13f5214e47906c3f697fcfcaa9e036035b941b8e3cfe_1280.jpg
7593064,ai,illustration,Unknown,Unknown,Unknown,popular,"automotive, vintage, transportation, old, sunset, background, nature, ai generated, background, ai generated, ai generated, ai generated, ai generated, ai generated",49168,30568,215,19,https://pixabay.com/get/g717682da4e0f5e69cca9be8539e72755778c43b3ba2a69a42875722f5b7c63fbca2882fd5abaa9fa79bcb06aa74b3f2d0f95adae9ee4b57908b1724de93375ed_1280.jpg
8720322,ai,illustration,Unknown,Unknown,Unknown,popular,"ai generated, young, girl, female, blue hair, freckles, curls, beautiful, portrait, ai generated, ai generated, ai generated, ai generated, ai generated",17442,8585,105,6,https://pixabay.com/get/g52027babf8bd21cac50fe7b76dccf962637983613202229c0c5819edf5b3f8974caff0a216ac245d884d56166fa9e1ee486a28de62e8d0b81dafb84db82d6c84_1280.jpg
8700383,ai,illustration,Unknown,Unknown,Unknown,popular,"ai generated, cat, eye, feline, animal, vision, iris, pupil, sight, look, focus, eyeball, see, green, ai generated, ai generated, ai generated, ai generated, pet, ai generated",19172,12592,209,17,https://pixabay.com/get/g15639671a919a8ad52b5ee2c3d89e7be70f3e948c008e89df0daa8da4aaf582a2885232d4170607c252654b12e0f86e67c49069ae4012688397effa9002520af_1280.jpg
8118606,ai,illustration,Unknown,Unknown,Unknown,popular,"ai generated, woman, cup, coffee, pink, blonde, ai generated, ai generated, ai generated, ai generated, ai generated",27213,9242,161,11,https://pixabay.com/get/g24c5c0f0d7dcd7ed1c47f677b33e17076cfda4cd9eae9135ef2edc1a82c241c99399017ac588eb189061a2fc3426d5a826eb8aa69a184d86f8c649b418252ea0_1280.png
8587505,ai,vector/svg,Unknown,Unknown,Unknown,popular,"ai generated, cat, kitten, cute, animal, pet, adorable, portrait, ai generated, ai generated, ai generated, ai generated, ai generated, cat, cat, cat, nature, pet, pet",17509,9586,101,4,https://pixabay.com/get/g6c42e8d0a8078f0267bd3e9425ec9ebefb56d0b673fb14da32d2f5490e91bb8eafe12ba217226fb948c669bf634c982fff4a190a4fafb380b58629d89302650d_1280.png
8520972,ai,illustration,Unknown,Unknown,Unknown,popular,"ai generated, man, portrait, monochrome, melancholy, painting, oil painting, artwork, ai generated, ai generated, ai generated, ai generated, ai generated, artwork, artwork, artwork",17137,9560,119,10,https://pixabay.com/get/gfa9dc5ae75275d7f3a73ca451096e9ef83eac66042ccc38cb941a991c9b8b06c90ff43e8268b9646004bc722eadc97d5cbdacf189739c18d973c7c9013a2137e_1280.png
7487706,ai,illustration,Unknown,Unknown,Unknown,popular,"halloween, jack o' lanterns, pumpkins, night, lanterns, digital art, yard, lighting, backyard, ai generated, halloween, halloween, ai generated, ai generated, ai generated, ai generated, ai generated",65490,40494,389,1,https://pixabay.com/get/g68cb731e48c97732fb0cd8070b2694549a6a6e36de47825c603426231af036341dc114a45436f02a84bfb3d069e893de9a06de6a0968d244dfbc38a988e86960_1280.jpg
8744705,ai,illustration,Unknown,Unknown,Unknown,popular,"agave, cactus, succulent, aloe, flora, nature, mexico, green, garden, desert, botany, botanical, ai generated, succulent, ai generated, ai generated, ai generated, ai generated, ai generated",8732,5128,79,6,https://pixabay.com/get/g380b58f20f12e964eedc545745123d6366b5b9d54eaa2524581748e88c82a313205660a72a4e2ff7e3cc6ab5568eddd01d2997563a44aac7675752c3fbdf463f_1280.jpg
8439292,ai,illustration,Unknown,Unknown,Unknown,popular,"animal, lizard, wild, nature, wildlife, red, colorful, ai generated, ai generated, ai generated, ai generated, ai generated, ai generated",6507,4519,49,3,https://pixabay.com/get/g8cf661691b66250fa0695ac640740c08fcd3ad569c3a71831f8139d43808f8f0601bfa10f3ed4006c28e7a806584cbd9c58fb2cc987d13b28b06ec4362500a38_1280.png
8548348,ai,illustration,Unknown,Unknown,Unknown,popular,"ai generated, four-leaf clover, clover, luck, leaves, happiness, green, nature, symbol, flora, dear, ai generated, ai generated, ai generated, ai generated, ai generated, luck, happiness, happiness",27124,18059,163,12,https://pixabay.com/get/g44824f24553b4a443577a7a3321bb0c8567fb57d1bce301bd712e830044bb03b36baf3478ccb781d0467df9202d8e16065d3d5d03126e2bb30284d5218c1a515_1280.png
8529788,ai,illustration,Unknown,Unknown,Unknown,popular,"ai generated, pet, dog, animal, flowers, meadow, field, intense, gaze, yellow flowers, floral, portrait, vibrant, nature, contrast, wildlife, ai generated, ai generated, ai generated, ai generated, ai generated, dog, dog, wildlife",20177,12115,245,14,https://pixabay.com/get/g5e12c79bc94db8e8f653d525311fcd7332d55e60c5e499dac8e05933e88db677869d85dd3093b83277f74a62ab3a105ea7534473efddf2a0cda3888b54d416a4_1280.jpg
8524928,ai,illustration,Unknown,Unknown,Unknown,popular,"ai generated, waves, mountains, sky, vaporwave, creative, synth wave, modern, aesthetic, neon, sea, ocean, nature, horizon, sun, dusk, ai generated, ai generated, ai generated, ai generated, ai generated, aesthetic",12207,7894,168,5,https://pixabay.com/get/gdb417225b59bc1102f9db289e19e0cc7fd938bea810fe8b9900c1dadb5eb739bd26a8799af371a965ea42bb000a8679548b094d7a3446ec474416e5357d6689a_1280.png
8985354,ai,illustration,Unknown,Unknown,Unknown,popular,"aigenerated, woman, paint, beauty, art, color, minimalist, beautiful, pose, style",260,151,8,2,https://pixabay.com/get/gd0229b9ab9ea8e1993477f5b7db8dbc0afae213821d4e04bfcc8f6ef2da30a7a37d513d717abe7e74758ccd96a316e4e7a976b89322e3ccfad4a8381640d2110_1280.jpg
7593872,ai,illustration,Unknown,Unknown,Unknown,popular,"winter, season, wilderness, outdoors, woods, trees, nature, snow tree, fantasy, winter art, art, ai generated, winter, winter, nature, fantasy, fantasy, fantasy, fantasy, art, ai generated, ai generated, ai generated, ai generated, ai generated",71737,42935,427,39,https://pixabay.com/get/ga9dd2ee47e8609f223b0e32990d6b95304579751b28b002a240141dfac971f5cddb761ffc3361366d8bed4f120896b9a1848cab2e764ce765e388482028079d8_1280.jpg
8662021,ai,illustration,Unknown,Unknown,Unknown,popular,"ai generated, mountain, clouds, night, nature, backgrounds, moonlight, star, space, galaxy, landscape, astronomy, planet, wave, science, outdoors, blue, milky way, dusk, horizon, ai generated, ai generated, ai generated, ai generated, ai generated, space, space, space",16830,10925,160,7,https://pixabay.com/get/gbd88042085bb2080b9828d99c10b865410acd4f4dfda4493e23310203b4fca9110d3a63b2495194d16610ccde468e02be7989bd8d73d23a90734fc21fbec306a_1280.jpg
9107853,ai,illustration,Unknown,Unknown,Unknown,popular,"ai generated, 2025, new year, celebration, party, colorful",115521,29064,34,7,https://pixabay.com/get/gd28dcdb979803aefde920f9307dc4730ad8169ad327ca8f2e314312bc4099baf7755869739f5f9bd09226c251c7727c17319664c4b100873884f863b1470b990_1280.jpg
8722478,ai,illustration,Unknown,Unknown,Unknown,popular,"bohemian, boho, goddess, woman, model, girl, portrait, face, fashion, lady, feathers, peacock, avian, nature, plumage, jewelry, jewels, gold, yellow, orange, warm, princess, magical, fantasy, pretty, ai generated, goddess, peacock, peacock, magical, magical, ai generated, ai generated, ai generated, ai generated, ai generated",9535,5209,123,7,https://pixabay.com/get/gf2daf64ebb98b3b2c3f085a481465100950af093472bc4fe465553d764485d00b81775cd52794a77a9d80ed447c14c8029c0311f2c0b3a6279b9deb9acb570a0_1280.png
8570323,ai,illustration,Unknown,Unknown,Unknown,popular,"ai generated, man, pirate, beard, face, look, person, portrait, ai generated, ai generated, pirate, pirate, pirate, pirate, pirate, portrait",14954,9098,103,9,https://pixabay.com/get/g876e34805c6e91ce6590706edfdc20dd8fbf49e4c41a938e54b4706cfef7af8b5d0bab83926e1b72e279f3a3a14fe690cb734c7af05c1da6adc1126c744685b6_1280.jpg
8195533,ai,illustration,Unknown,Unknown,Unknown,popular,"ai generated, fashion, woman, girl, portrait, model, costume, dress, green, beautiful, fashion design, ai generated, ai generated, fashion, fashion, fashion, fashion, fashion",9551,6171,86,9,https://pixabay.com/get/g03bfa316335b3c0b7ada49b080e46ee9edca3ef0f29c9b315d7ee69762334f642d579260c59ef73235fa72d3755c9f603299ccd3365ab9c029856e3aacd1c8e9_1280.png
9302934,ai,illustration,Unknown,Unknown,Unknown,popular,"ai generated, 2025, new year's day, celebration, new year's eve, happiness, fireworks, sparkling wine, glasses",1410,1043,42,2,https://pixabay.com/get/gf5e66c2f8acd5fde8dd3c8e86c404bf1a91bf69ed1dc4f956382287e3d2a8abcb77cdc9ad4f24d7a61ed9a08ca9fc25d7bbc8cc472b6f675c2cd70a16805770e_1280.jpg
9097395,ai,illustration,Unknown,Unknown,Unknown,popular,"ai generated, 2025, new year, glowing, sparkling, celebration, light, festive, golden, reflection, night, sparks, illuminated, bright, futuristic, glittering, glow",27134,10644,66,6,https://pixabay.com/get/g05d713cd637a9d465f00cf5681d845f244338090b6dd9b60ff62d4f8983ac30a8df6640cb9912ea2c9a919542c0f815a8c6828169969ac059d01e0bce2502aa2_1280.png
8692405,ai,illustration,Unknown,Unknown,Unknown,popular,"ai generated, leaves, nature, foliage, pattern, tropical, forest, backdrop, wallpaper, plants, green, jungle, ai generated, ai generated, wallpaper, wallpaper, wallpaper, wallpaper, wallpaper, jungle",28162,19894,156,10,https://pixabay.com/get/gaa4631e34ebc7d4ca67370df9d97cc0b5875709caebfaf96c2db993f8471525f5a00fae17cd16f626057e869d382fdfba085fe5e45678aec9076dd5547202d16_1280.jpg
8575768,ai,illustration,Unknown,Unknown,Unknown,popular,"cat, black cat, eyes, table, curiosity, drawing, ai generated, cat, cat, pet, animal, cat, cat, cat, ai generated",38969,27988,297,24,https://pixabay.com/get/g327b98e121e9b67ddcaccd1d403b250616bfdccf0520bb065bff65459cf5cabccec79bf5c2447d627865e8a2cf80bf86e5a0b4bdbc5c649c7368e373f666125d_1280.png
8770966,ai,illustration,Unknown,Unknown,Unknown,popular,"lips, melted, lipstick, coloured, germany colors, european championship, soccer, 2024, ai generated",1555,1292,38,0,https://pixabay.com/get/g0f3318f2826aec4e2006f4cb835ed69417015daa7fda05cc83e4b670ae7e2409ffd86797f3d2630f285ddde1413eb7fc20bd0c90c41e8f12e34a100f9f883f57_1280.png
9033871,ai,illustration,Unknown,Unknown,Unknown,popular,"ai generated, 2025, new year's eve, new year's day, happy new year, postcard, turn of the year, end of the year",32356,9412,27,1,https://pixabay.com/get/g059e4252fe345e227eeb4dca44b7f002a4a7a4ab377629d6c2f7e6170d96f11bf1f5714205bcb79e0306b080842d74637ef23817615cb3db911d1a06a5cd6a78_1280.png
8693634,ai,illustration,Unknown,Unknown,Unknown,popular,"peacock, bird, nature, feathers, animal, colorful, green, blue, ai generated, peacock, peacock, peacock, peacock, peacock, ai generated",20170,11233,178,4,https://pixabay.com/get/g0ace6625f43b0207bb55748e175c6515745d6e790d0def68a136f05e7b5b393ee9b5c941cb8961e5bf57555ac1bb600a54483a1f775afaf304e27c5e9d1cd99a_1280.jpg
8146519,ai,illustration,Unknown,Unknown,Unknown,popular,"ai generated, 3d wallpapers, woman, eyes, avatar, butterflies, cute, anime, 3d, female character, fantasy, wallpaper, ai generated, anime, anime, anime, anime, anime, 3d, fantasy",12795,9326,59,3,https://pixabay.com/get/g2c44c7095ec3ffac6e23c342bd1bff91daeeefc96b74345f4122b6377e2c170762b79d89fa7002088e875dcc308a865805282c54e614ff20f735636047406b21_1280.jpg
8863743,ai,illustration,Unknown,Unknown,Unknown,popular,"ai generated, bubbles, balls, abstract, art, multicoloured, coloured, background, ai generated, ai generated, ai generated, ai generated, ai generated, abstract",5195,3491,96,5,https://pixabay.com/get/ga8dd7ec09b941740a290d2c7d1e4d833b9e3be2bfac42c5e532ecbf01f44254523bb5811d503e9ef4f8bbf116b106f048414caca394da230f236acb55e9d8dae_1280.png
9030383,ai,illustration,Unknown,Unknown,Unknown,popular,"ai generated, 2025, new year, celebration, holiday, metal, celebrate, rusty, metal effect, numbers, industrial elements, steel, typography",4416,1799,15,2,https://pixabay.com/get/gcfb70c05b9e0f63635057e4cae3f13bc683c0b73b5ff3a58c40dddff6e071b8e7be6fe0c1a58b6f766be67939d20c9884045a453fab5815eef61bbd7850f4299_1280.jpg
9021077,ai,vector/svg,Unknown,Unknown,Unknown,popular,"ai generated, 50-30-20 rule, finance, money, wealth, savings, investment, financial, coin",3189,2964,4,1,https://pixabay.com/get/ge5790f3262f09460235722920f472fb6ab44ba95008373e1af798131a36ca9135e49d2e99a10aca41980722c7fb5aa870aa26550382dd8508057bfa850da1903_1280.png
8631634,ai,illustration,Unknown,Unknown,Unknown,popular,"ai generated, architecture, building, house, pod, modern, design, futuristic, technology, sci-fi, ai generated, technology, technology, technology, technology, technology",30853,20305,188,22,https://pixabay.com/get/g5558de9bc404137be36f52744d44d11eb286072853d4391394d463e51e0b424b427d8359e45d51f237ef4c9b05e2754cfc7bc1fa9dbe338f38ce3485ec8d3c8d_1280.jpg
8069999,ai,illustration,Unknown,Unknown,Unknown,popular,"ai generated, 1932 ford, car, classic, vehicle, auto, automobile, model",527,351,11,0,https://pixabay.com/get/g837bf02a656a60cf1752c52b32009db41011e70720370d96088f2ade61021eb2981dac3ba32ca619b2ca0daedf61dc995744ae622d88c8bedf61927275b5da7a_1280.jpg
8288828,ai,illustration,Unknown,Unknown,Unknown,popular,"ai generated, 3d wallpapers, woman, avatar, anime, cute, female character, fantasy, wallpaper, 3d",1199,765,16,0,https://pixabay.com/get/g0678a860d3bbc7acc9c99eb1bb12b4e574adfd45e82275877da241a06193387b26e6161d224efb54ff8be2c02bf1bab8d43a594348fe5e551883bcf509bdc5ef_1280.jpg
8201383,ai,vector/svg,Unknown,Unknown,Unknown,popular,"ai generated, santa claus, sunglasses, christmas, holiday, vacation, snow, nature, ai generated, ai generated, ai generated, ai generated, ai generated, christmas",6626,3727,92,5,https://pixabay.com/get/g07a7549ccb83522edd90cffd6390844ea3884ee2176bc0beb924d8231c5ccce1c7384b1e50bd80e712e3a0d49ef26e882f82e3bf938d054e9bb00341f6dfc4ab_1280.png
7949215,ai,illustration,Unknown,Unknown,Unknown,popular,"ai generated, woman, art, painting, colorful, style, colors, abstract, person, girl, portrait, ai generated, ai generated, ai generated, ai generated, ai generated",6433,4320,105,21,https://pixabay.com/get/g38766ca46b58fef31afd63265865b85cb61417bf664a63c220d2a60877e0403d352ab3a6391f6dbdef0449a2c2cd2b7d17af8ce9caffefd5516f046a14f09a15_1280.jpg
8182788,ai,illustration,Unknown,Unknown,Unknown,popular,"ai generated, 3d wallpapers, woman, cat ears, eyes, anime, character, fantasy, wallpaper, avatar, 3d",1463,938,20,0,https://pixabay.com/get/gd4f358e1e68b88785779bae255677a8a1faae83384d2e24e656f017ac44d31da9bd2e43161109399f9a4fedd4a35120c908a3ad33acaa3c9c97cb24788270731_1280.jpg
7855609,ai,illustration,Unknown,Unknown,Unknown,popular,"ai generated, woman, flowers, blossom, portrait, girl, beauty, ai generated, ai generated, ai generated, ai generated, nature, ai generated",3950,2225,99,8,https://pixabay.com/get/g612f07e813012628fa8bf7a361f01f94bd6b9b702bb78fff7650b6ecef1cebd314fb13f46f41d947bfbfdc704a909c7989b373645b73b6065d6ee9f56490878c_1280.jpg
8350198,ai,illustration,Unknown,Unknown,Unknown,popular,"christmas, model, woman, photo shoot, pretty, christmas2023, ai generated",541,329,6,0,https://pixabay.com/get/g8b7916f40b5088b174a7c6372f0ca38a0e883735a4821d4c8c7158c796feb6307df93d08a639ae4ca6cc1ffc27562af3cb1a36e3c6726f6b689377e93774cd7f_1280.jpg
7935368,ai,illustration,Unknown,Unknown,Unknown,popular,"ai generated, art, pet, cat, drawing, mammal, animal, feline, mascot, ai generated, ai generated, ai generated, ai generated, nature, ai generated, cat, cat",6818,4633,121,17,https://pixabay.com/get/g9e8c42ca5dde0279a6da1144ce6c394d4208e3aec8a819482006f775fa2f554e868a929f6e0ef3223876c5281b000308e468188c1c31b248d9b0820c615895e4_1280.jpg
8815780,ai,illustration,Unknown,Unknown,Unknown,popular,"ai generated, woman, portrait, face, posing, multicoloured, creative, radiant, ai generated, ai generated, ai generated, ai generated, ai generated",3295,2291,98,0,https://pixabay.com/get/ge6876a21c10b6c1ba106fee85edc9b089dbe4b2e02716435a134d8b7c842ba7fb1d05de798c51bce395eeb378b0fad24ac6b8fb541569471d592fa61692eccc8_1280.jpg
8703394,ai,illustration,Unknown,Unknown,Unknown,popular,"ai generated, woman, red, glow, glitter, mysterious, magic, dream, fantasy",34478,18499,330,32,https://pixabay.com/get/g867a1bae22b36db95fd3967546ea6c6fe6631e2f22796c3f47df9f05381b0153817f0e3d0c4a78677eefef01445c814d32f3f70e456c4958094a4d12a5dbb2c6_1280.png
8172974,ai,illustration,Unknown,Unknown,Unknown,popular,"ai generated, woman, face, character, eyes, manga, female, japanese, beauty, anime, portrait, background, ai generated, ai generated, ai generated, ai generated, ai generated",9969,7362,85,5,https://pixabay.com/get/g982a207ea0483b1d81cfb85e0e85645661d14aaf93eceb1314f7264cd4bb687e05bb020484feec378d4847ad92de0ef63dcfd9ba45d6c81b16885d12376eb695_1280.png
