ID,Content_Type,Image_Type,Category,Colors,Editor_Choice,Order,Tags,Views,Downloads,Likes,Comments,URL
8581529,authentic,photo,Unknown,Unknown,Unknown,popular,"sea, waves, sailboat, boat, catamaran, atlantic ocean, sea, sea, nature, sea, sea, sea",33122,26804,191,18,https://pixabay.com/get/ga0371382136188c259284bd0c0b991d2b2e9d0163e29fb3aedf5421789a7792c8db315da9d1fb66062f96168bf08e94a5c8c02add1e2fa6f8b821e829733f9a0_1280.jpg
9380294,authentic,photo,Unknown,Unknown,Unknown,popular,"forest, nature, landscape",4255,3469,84,10,https://pixabay.com/get/g501bc64696b44ad981de3ef55cea54550b7a106aec44f5285e54d75159d0a10f8e95b5bf6538a026ea38badcaf1c24f34df149702e8cc74bcd4fb45807d36e65_1280.jpg
9432362,authentic,photo,Unknown,Unknown,Unknown,popular,"crocuses, calyxes, early bloomer, signs of spring, petals, beautiful flowers, purple flowers",1428,1336,45,17,https://pixabay.com/get/g2a2453ce4d302652bf0076c8d1a72870a7d468308ebb9523f616c3f18dc7fa0a3da62e51cdd4f6125605ab00af25d8b325113c6501ecec720258a821572adfb1_1280.jpg
9453348,authentic,photo,Unknown,Unknown,Unknown,popular,"girl, casual, sneakers, eye glasses, sitting, nature, park, plants, relaxing, relaxation, spring, lifestyle",1203,1121,20,3,https://pixabay.com/get/g7654b4bc5089f5923f04a52a28d7cb15bd3766973f2b760f9929d2a9403450fc9be4a2f58860bea836f6547c797fa77eb76aeb395926d2dcb64cff222648fe3d_1280.jpg
1375125,authentic,photo,Unknown,Unknown,Unknown,popular,"happy valentines day, couple, love, stars, hug, pair, romance, night, love wallpaper",374662,244176,827,121,https://pixabay.com/get/g18546c186973394e0c2721f4e728c99de0eed9e3faa5eb562be138b85cfc21c3176535288fd95a35653f71baed685baf0c11b1330c916e85b6524c872c2ce596_1280.jpg
9405635,authentic,photo,Unknown,Unknown,Unknown,popular,"dog, animal, mammal, canine, domestic, pet, nature, puppy, cute",2344,2261,73,30,https://pixabay.com/get/g4cd9a97dbfb75155fea476130ad71a659f2fdbb12402d5e388e7e51e87f71905cf5b3b32ddde3b46c4896f15ec01c2fdc110704685e77062c5b650d0065df112_1280.jpg
9263545,authentic,photo,Unknown,Unknown,Unknown,popular,"landscape, view, stars, world, night, darling, stars clouds, fog, winter, cold, moutains, nature",16361,14510,199,37,https://pixabay.com/get/g0f2b344331706d68d159ad86956e9b9c3e5621f6866a6e49681a64d5a88ba9cb1ea4c8968fa7ed8d22845d17f6514ad747429068c5c42122be22fde899a58173_1280.jpg
4813260,authentic,photo,Unknown,Unknown,Unknown,popular,"wine, bottle of wine, red wine, cup, alcohol, glass, wine, wine, wine, wine, wine, red wine",152933,99683,327,73,https://pixabay.com/get/g580e62232552dd6830f63874d467225ba3c66c5d1fc16272f52d452ed8f3da3ad313c902f37c7994559f45867e76f81acf24b9b4eead6f00af8cbad10af00747_1280.jpg
8705377,authentic,photo,Unknown,Unknown,Unknown,popular,"kingfisher, bird, animal, feathers, plumage, beak, nature, wildlife, avian, ornithology, wild, colorful",15470,12084,158,21,https://pixabay.com/get/gf7321ee4ac85647f8183cd825ae363a82100867f0d64e329652cc7bba8f718a6d193e692f4b672e9913240e5d0b50397bb7b0fec7f64503dc478cef5a5e96051_1280.jpg
2739472,authentic,photo,Unknown,Unknown,Unknown,popular,"sunset, desktop backgrounds, wallpaper hd, cool backgrounds, federsee, bad buchau, idyllic, beautiful, mood, scenic, landscape, beautiful wallpaper, silence, background, quiet, laptop wallpaper, relax, nature, idyll, boardwalk, heaven, 4k wallpaper, atmospheric, free background, windows wallpaper, sunny, full hd wallpaper, water reflection, romantic, uferweg, background, background, 4k wallpaper 1920x1080, background, background, relax, wallpaper 4k, hd wallpaper, relax, relax, mac wallpaper, free wallpaper, relax, relax, heaven",192044,151325,422,57,https://pixabay.com/get/g91039f40268caa3d37061a19edffcbfa42f67755d6a89e6b7386caea431b1bd67830ea6c545d84ff6b35aa1c1456e2010776988b1c252b09d6751c3e92645fd1_1280.jpg
9465962,authentic,photo,Unknown,Unknown,Unknown,popular,"red squirrel, squirrel, nature, rodent, animal, wildlife, mammal, forest, food, nut, tree, wild, britain, native, uk",180,172,5,2,https://pixabay.com/get/gbbfea13b77873a2b138783d8d101a27613168cf0d99033b4baffff4f24630c227941d8a03bbb14da28b219d2e49aa8871bafa0bdf83550be9de3bb7fcd2d30e7_1280.jpg
3025022,authentic,photo,Unknown,Unknown,Unknown,popular,"drink, coffee, food, coffee cup, leaves, autumn, book, sweater, mug, relaxation, cozy, coffee, coffee, coffee, autumn, autumn, nature, autumn, autumn, autumn, book, cozy",283298,176458,853,62,https://pixabay.com/get/g95b5d37f66c8b8c29b2e8a8f089e06fcddb67a9dd61fd41ac007ac6047457e9998f9072963526a20cb627507f6b2c94afdc016c5255485e98dcfdab16b41cc9c_1280.jpg
6275164,authentic,photo,Unknown,Unknown,Unknown,popular,"origami, papers, japan, background, desktop backgrounds, wallpaper, scrapbooking, digital scrapbooking, free background, mac wallpaper, design, decorative, hd wallpaper, arts and crafts, wallpaper 4k, origami, free wallpaper, cool backgrounds, windows wallpaper, origami, 4k wallpaper 1920x1080, origami, japan, japan, wallpaper hd, beautiful wallpaper, 4k wallpaper, background, background, background, laptop wallpaper, background, full hd wallpaper, background, design, design",135768,112024,201,41,https://pixabay.com/get/g9668cdeaf2b851e9cdf98bea75c4b9ae711259e91a94a742d3e55d3795f27df60532d509dcd1f12c42f7f0b376946c0d13e6fd2b551de6b647e508276cb5ce68_1280.jpg
9451055,authentic,photo,Unknown,Unknown,Unknown,popular,"heron, nature, bird, animal, wildlife, grey heron, ornithology, water bird, fauna",377,354,27,9,https://pixabay.com/get/g04465356652041b42649c81694fac3599a3c4962d61ce3f85ef2847286c9130b196dc92550318ec68f6b2c7cc8160c5b61d7fb10f1c9d993ec0e234c919780b4_1280.jpg
8504392,authentic,photo,Unknown,Unknown,Unknown,popular,"leaves, poinsettia, plant, beautiful wallpaper, christmas star, floral background, red leaves, green leaves, nature, background, foliage, background, background, background, background, background",70055,61206,721,37,https://pixabay.com/get/gc8700f7fe5cec1721a6145e7afed339501b3491b52ab16fbed33a002f9572484d0db9fa5e2a0829422cdf4cbb6a7ca016701b762a9006ca29af86195ddb02579_1280.jpg
1549399,authentic,photo,Unknown,Unknown,Unknown,popular,"happy valentines day, hand, gift, bouquet, flower wallpaper, love, beautiful flowers, congratulate, give, flowers, flower background, bunch of flowers, offering, nature, fence, concept",644637,358239,1448,212,https://pixabay.com/get/ga35c51cb3d1e6f4090ec3739716b4dfe3d4a527e202230fbbbc0ad7b8b90930ff941dddd716dfcdec79c7dc62d09c5ebb52ca693186758e94f8918ec4bf8c57d_1280.jpg
3548021,authentic,photo,Unknown,Unknown,Unknown,popular,"wallet, empty, poverty, bankrupt, finance, money, to pay, costs, pocket, lack of money, save, wallet, wallet, wallet, wallet, wallet, poverty, poverty, poverty, poverty, bankrupt, money, money, money, money",210613,127740,453,90,https://pixabay.com/get/gdcecd2fc641a681a093ef83e871d50ab369ad33f424976c03b1debe8c92fa5d78510768c23559f4be54947cb990a030204b86fdc4a6a4136c2f695d18d5bbb6f_1280.jpg
9426745,authentic,photo,Unknown,Unknown,Unknown,popular,"chateau, lodge, laptop wallpaper, 4k wallpaper, desktop backgrounds, nature wallpaper, pond, 4k wallpaper 1920x1080, windows wallpaper, basin, cool backgrounds, reflection, full hd wallpaper, park, garden, beautiful wallpaper, landscaped garden, beautiful nature, hedges, wallpaper 4k, free wallpaper, free background, wallpaper hd, hd wallpaper, trees, nature background, shapes, nature, mac wallpaper, wallpaper, desktop picture, hintergrundsbild, yk",2378,2226,53,15,https://pixabay.com/get/gb404be8fb68caaedde1f757094e69bef57fe6e786e2523483a3124a4657342b0936985c1a87e07b6b1e278e84ed70519a867c32ef337efc0ed0623451e48f4e5_1280.jpg
9444646,authentic,photo,Unknown,Unknown,Unknown,popular,"blackbird, bird, ornithology, bird watching, wildlife, nature, species, animal",1054,1017,30,8,https://pixabay.com/get/g67c7b0d66747f96802574f457af98c8281d06efe0468b441fea7ab8472dbef7fe05cb4dd09c23fdb41dde8dfafc461fd4f80e9d3afdaae5b30a4cccc08317e16_1280.jpg
9411585,authentic,photo,Unknown,Unknown,Unknown,popular,"rose, flowers, plant, petals, bloom, flower wallpaper, flower background, nature, flora, vibrant, rose flower, fresh, elegant, beautiful, beautiful flowers, delicate, floral, botanical, romantic",3634,3379,73,0,https://pixabay.com/get/gf4f797574424a00c579e3ea5c78abb00a4d3e768c58d9044231729990d9b5cffebbc932c3a2d72212f50467e7d7616261c133c434a2910cde00c966073e4e36e_1280.jpg
9465444,authentic,photo,Unknown,Unknown,Unknown,popular,"carnival, move, costume, to celebrate, artist, art, mask, madeira, artful, energy, pleasure, happy",241,220,8,3,https://pixabay.com/get/g21ed5dfceee5aec9aac21ce3da7adb5e0c770dbd06245d7176b9851e042dfe68b454e5d63f68c248d47e1002c8de30409fcdbaaa74352ff020ebbf4fba28bc02_1280.jpg
9296128,authentic,photo,Unknown,Unknown,Unknown,popular,"city, flow, skyline, building, ship, eve",9853,8903,50,11,https://pixabay.com/get/gae36a8468658d8c2b530f5553d01cb6197a909d21468626ecb27910a1aca06860cff016186ce4dc083ae44c1a85d1547a8ad1b15a70a26a87944de8fa90f1696_1280.jpg
9458325,authentic,photo,Unknown,Unknown,Unknown,popular,"plum blossom, spring, blossom, bloom, flowers, branch, plant, petals, buds, pink flowers, pink petals, flora",138,126,16,3,https://pixabay.com/get/g2231cf54abc9e363418bc26a67842c94638e1baf01249cbad98f07cc99ab5fff028e74ed1ad70595f51d392977acfdb66aca9770a309e75ed6082149e4d1e7b4_1280.jpg
8578205,authentic,photo,Unknown,Unknown,Unknown,popular,"green parrot, parrot, bird, animal, feathers, plumage, beak, nature, wildlife, avian, persimmon, tree, green parrot, green parrot, parrot, parrot, parrot, parrot, parrot",22164,16967,124,15,https://pixabay.com/get/g8c9d8172636532b5514a5ffb495d0e3c84fd908cec3b1d0192d1c969528c8adb0f21f7e9a7fcafb5420c73335fe33b025615690be6148137b2171bdd10887424_1280.jpg
9454567,authentic,photo,Unknown,Unknown,Unknown,popular,"squirrel, nature, animal, mammal, rodent, fauna",173,157,13,3,https://pixabay.com/get/g332d41d6df1b255e7069efda643f9d22af8f53f4d488438a4b93c65cebe3f80ec2810648695633a5ac283258414654d864b178cac175cf2a9d73b1ef7968e390_1280.jpg
8195026,authentic,photo,Unknown,Unknown,Unknown,popular,"cairn, nature, stone tower, balance, rock, stability, harmony, stacked, matterhorn, mountain, balance, balance, balance, balance, rock, rock, rock, rock, mountain, mountain, mountain, mountain, mountain",52019,44789,271,78,https://pixabay.com/get/g1777b1d766dd61d61c19c1f418f46207f887fc713f605d08bc541027b731e5d77a431f44872454b21e65e6a0c376242e56b273c50c3bf296e8cb5aa59a6e619f_1280.jpg
9448241,authentic,photo,Unknown,Unknown,Unknown,popular,"kingfisher, bird, animal, wildlife, multicoloured, nature, bird watching, background, hd wallpaper, hd background, full hd wallpaper",566,538,25,9,https://pixabay.com/get/gc5587e832ad9eaa9f82a88d5b43499ae79f69bbc2037bad150cbff0b191ace4f26f15aaf6b3e25905cc46754700c647763c571b55a8f22b38e0962bba0febc31_1280.jpg
9466632,authentic,illustration,Unknown,Unknown,Unknown,popular,"waterfall, nature, landscape, river, mountains, scenic, moss, outdoors, mood, trees, perspective, view, scenery, countryside, flow, torrent, canyon",1457,1128,47,21,https://pixabay.com/get/gfeb4c27bc0c5717efc5194ba716008775c1b07f73716d191eec31b1bf1770d6a603784f09582b0719298548b66093f310790b7aeba45324e971e6ba62c8c935c_1280.jpg
9468809,authentic,illustration,Unknown,Unknown,Unknown,popular,"giraffe, silhouette, nature, animal, mammal, africa, fauna, herbivore, long-necked, long-legged, species, eating, landscape, tree, sunset, artistic, texture, educational",516,466,30,11,https://pixabay.com/get/gdd6cf8f5f2f44f622c1ea63e4ded6d5d7afc4682eca289297c8c7db81c081fa19395aac08dc431275371af83b0e2099b95cdea02e9b724c9cc15ddb9b5e58bf9_1280.jpg
9468812,authentic,illustration,Unknown,Unknown,Unknown,popular,"woman, ocean, sea, sunset, horizon, beach, nature, waves, seascape, coast, sky, dusk, twilight, clouds, scenery, scenic, view, mood, copy space, girl, alone, solitude",573,477,33,12,https://pixabay.com/get/gb03f52bde33900526d8e1f25a6f2529ff529d2b9abd76a7d088c2ffb7e7b833600a064a0f635724117204cfd00d0f5bfc2a1d044eef744fcecdb2176ccd2de0d_1280.jpg
9467213,authentic,illustration,Unknown,Unknown,Unknown,popular,"abstract, painting, wallpaper, multicoloured, coloured, color palette, shine, kunterbunt, colorful, rainbow colors, dazzling, background, metallic, glittering, red, blue, green, yellow, pink",417,318,40,9,https://pixabay.com/get/g649690daa0d56673e5e1c6bb2f814d6b7de56a3e53121f5c13cc604e8c49fba563c750455304190193cba8b487c143a6be14fbdd8c5822f41bc7542043dea6aa_1280.jpg
9469396,authentic,illustration,Unknown,Unknown,Unknown,popular,"sunset, ocean, horizon, nature, dusk, landscape, twilight, sea, sunrise, clouds, scenery",387,292,37,11,https://pixabay.com/get/ga20c029bc232e86f8c3658d0bf0f003eded89b458c2b9f96e0afc13c10d0f81df3efb88215811ce687e38fb871fa3aee2fa25d2c738dd65d9a6b43cf6aa05d24_1280.jpg
9468808,authentic,illustration,Unknown,Unknown,Unknown,popular,"flowers, rose, nature, bloom, blossom, flora, petals, botany, abstract, modern, design, artwork, pattern, fabric, floral background, geometric, mosaic, texture, scrapbooking, background, template, pixelated, pixels",335,282,26,11,https://pixabay.com/get/g22888cf163f35feba6bd15e4ac8be2d67ff805d7eb3bb5e1bb32b86977289554377618fed91222b1965a58813e8cf2695eb5ec143b8319152ab28c98a76eb1a8_1280.jpg
9467211,authentic,illustration,Unknown,Unknown,Unknown,popular,"abstract, painting, wallpaper, background, harmony, multicoloured, coloured, color palette, shine, kunterbunt, colorful, rainbow colors, dazzling, metallic, glittering, red, blue, green, yellow, pink",652,517,46,8,https://pixabay.com/get/gf3c5e3f99119740978fc422aeffd7bee10499d6e4a22a15f15d08da18a50832030bac5a14d7aeed0315f0c01a70d43ece3be8f2d791e77d1ba67e24329c874c7_1280.jpg
9466584,authentic,illustration,Unknown,Unknown,Unknown,popular,"man, raft, fog, male, person, adult, rafting, water, river, adventure, travel, tent, sky, outdoors, forest, trip, nature, mist, foggy, mood",658,561,33,6,https://pixabay.com/get/g1d47c47a5f1fb56e30fb34b29c9696a4d98569805d68ccf5f7d5e781a840d203b3d59f01f0db7e64c37813c142a89db254e159e7094a4f23cce9475aad61f212_1280.jpg
9466589,authentic,illustration,Unknown,Unknown,Unknown,popular,"cityscape, buildings, city, urban, architecture, skyline, skyscrapers, modern, facade, construction, colorful, business, apartments, home, office, tower, workplace, commercial, cartoon",644,582,30,11,https://pixabay.com/get/g881a02d56137f7b1d4ff9e69045d0917ec742476d3995c8905f8a4ffd235a64d3ed49d967f96f4859ae1ae0bf62c7fc011efbda4bdd9d87aacafd3eee1a613ba_1280.jpg
9473487,authentic,illustration,Unknown,Unknown,Unknown,popular,"colors, abstract, coloured, color palette, multicoloured, shine, colorful, rainbow, dazzling, nature, background, metallic, glittering",194,128,30,5,https://pixabay.com/get/gd8561e065e1df9ce86cc6aeea1f539798d6e4004720a2bd72862fb4e43295570cd70dd4f61970d5cc370b99a97e8f730b6e43f20d898df96d69f48722ced3138_1280.jpg
9470294,authentic,illustration,Unknown,Unknown,Unknown,popular,"eggs, easter eggs, decoration, painted, symbol, easter customs, easter, ai generated",167,114,31,0,https://pixabay.com/get/g78d59b72b5c8de633e61b92fbbd16d906a4e6b8661f58b4552ef09439e73637c0d07f93104d2b6767bd8578044f70f819c53632d1985d74189d0d3369557bd67_1280.jpg
9468810,authentic,illustration,Unknown,Unknown,Unknown,popular,"marketing, business, technology, data, internet, seo, communication, advertising, online, media, analysis, digital, web, global, international, world, globalization, connected, symbol, icon, cutout, blue",237,194,20,7,https://pixabay.com/get/gf6612ac758d62e8faf6686f1b1481d5571cfc4c6ecb4ccc010f633558fc91c1809a7d4b6702f2d42968fa44a7cd5feb674bc86e05f744dd1a673914ad7f0b180_1280.png
9466590,authentic,illustration,Unknown,Unknown,Unknown,popular,"car, van, vehicle, transportation, automobile, auto, race car, speed, fast, vintage, retro, custom, modified, transport, design, classic, cutout, 3d render",541,486,30,7,https://pixabay.com/get/g12206d93aeec060b7bfe9044206890875131f3386bcbf7ae3e67403ae87d9d42c4c727fabcb100463efbb7d1598f929f2b8f4593b2604bf89a3530ebe178a54e_1280.png
9467216,authentic,illustration,Unknown,Unknown,Unknown,popular,"abstract, painting, wallpaper, background, harmony, multicoloured, coloured, color palette, shine, kunterbunt, colorful, rainbow colors, dazzling, metallic, glittering, red, blue, green, yellow, pink",517,414,41,6,https://pixabay.com/get/g2fc01341d448029209e00703f17ffed37efb8202d7844c56699073fad76d3e38e163e4092190a6dab77daca19b838031b8b9ca168d4e1e56f953c72295cb56b2_1280.jpg
9463325,authentic,illustration,Unknown,Unknown,Unknown,popular,"moai, statue, culture, stone, face, rock, ancient, figure, history, monolithic, easter, island, mystery, head, civilization, monument, sunset, dusk, nature, landscape, twilight, sky, clouds, colorful, silhouette, educational",1272,1115,40,11,https://pixabay.com/get/g04af6f86885fd3d917ef3765f4987375c12ebf243831cdf9591f9662b9012336e97a7496b84540ef02b3e746f4f35cec5e2175410cb8e247c63db33da02763ef_1280.jpg
9467214,authentic,illustration,Unknown,Unknown,Unknown,popular,"abstract, painting, wallpaper, background, harmony, multicoloured, coloured, color palette, shine, kunterbunt, colorful, rainbow colors, dazzling, metallic, glittering, red, blue, green, yellow, pink",416,339,40,7,https://pixabay.com/get/g43796cabd55e6a1eedb7fdc8eb6ab4e1b8cfe79707b12475994b481acedf1f01d3fda90cdd381fe217d6a50404167084ec2bf6de99b8e8128d4a49cb2dee0fb2_1280.jpg
9467215,authentic,illustration,Unknown,Unknown,Unknown,popular,"abstract, painting, wallpaper, background, harmony, multicoloured, coloured, color palette, shine, kunterbunt, colorful, rainbow colors, dazzling, metallic, glittering, red, blue, green, yellow, pink",387,308,38,9,https://pixabay.com/get/ge8d1bcf56617f61d52e8c119f8fe0723c21f6e62752f7f07643b5a6c8e1699b4c9763fcd521a8a5c41335786c352a28f1981584844c3cc79e2e00d2c44c61a65_1280.jpg
9463327,authentic,illustration,Unknown,Unknown,Unknown,popular,"man, desert, couple, woman, together, relationship, romance, happy, nature, outdoors, travel, exploration, road, mountains, adventure, landscape, tourism, dune, cactus, sand, cartoon, copy space",1042,903,38,14,https://pixabay.com/get/g7eec825566dbc44abeead8970dbb93fea321e74d44c215ffa23e39003560ed6b3d26a19ecd754488fe8757687b126a81aba46adf5c3a30af8c59bcbf43819f21_1280.jpg
9470794,authentic,illustration,Unknown,Unknown,Unknown,popular,"cacti, flowers, flowering, succulent, nature, flora, plants, ai generated",150,126,26,0,https://pixabay.com/get/g2141b54a32f97ead7151f0199f9dd325a16364d30ee6e08ea5af54c9c394b54abda8df6f5dbfbd766cc9aa108bacae73880bcb73d3507122a037b578efe28304_1280.jpg
9465465,authentic,illustration,Unknown,Unknown,Unknown,popular,"ai generated, unicorn, horse, shore, beach, fantasy, nature, animal, horn, spell, design, color, magical, pony, seaside",418,331,35,2,https://pixabay.com/get/gb5900c558366630f80f7c112d0e62e73e9d8029bedbbb76eb95a06408f8891a00c6de5bf550f7c99f78bbf591a22e3654b9ad10fd7b8e4dfe76e5045ed43812a_1280.jpg
9457920,authentic,illustration,Unknown,Unknown,Unknown,popular,"butterflies, insect, pattern, nature, wings, animal, entomology, bug, wildlife, pollinator, lepidoptera, fauna, seamless, texture, design, decorative, scrapbooking, background, blue",1840,1626,46,20,https://pixabay.com/get/g4e087414a90cc53f4462b13b2777bb16657e674be3f2d80b0b791bc8e17ae2d9e1196fc1242c104b1985fabc3055e7ffac7a4d006417591414c43701c79fdcdc_1280.jpg
9460556,authentic,illustration,Unknown,Unknown,Unknown,popular,"ladybird, ladybug, bug, animal, species, droplets, nature, rain, macro, ai generated",1462,1246,65,2,https://pixabay.com/get/g13372caac9cbf1aa105f8e137ecbdf2606ca889ed868c42d3a6b62c84faeac9954ea253c7a382d0b9d2b41fe3d3d08d4713a44d7f061250fa57479f765a2f065_1280.jpg
9463324,authentic,illustration,Unknown,Unknown,Unknown,popular,"gears, pattern, cog, steampunk, vintage, past, retro, clockwork, style, machine, cogwheel, engineering, technology, mechanics, industry, mechanical, metal, seamless, scrapbooking, background, brown",838,777,32,10,https://pixabay.com/get/g7a5bab7236f0cdbd2281fc2082b4649a4502593a1fa2bacdc2288165cf71a5d95a99ac9f4a6674867ce236a90c4d8a1147974d41f3c39a5c890220bad024ab5c_1280.png
9460551,authentic,illustration,Unknown,Unknown,Unknown,popular,"frog, animal, reptile, nature, forest, ai generated, wildlife",1554,1380,65,1,https://pixabay.com/get/g74c5cc08543f777e37297712cc3524736c19c90d33d47758852c4a59401313c5ff4155c94e6cf323515227c860ed37589ea2ced39843aec94ab5ce45e65f27e2_1280.jpg
9465463,authentic,illustration,Unknown,Unknown,Unknown,popular,"ai generated, unicorn, horse, shore, beach, fantasy, nature, animal, horn, spell, design, color, magical, pony, seaside",311,250,32,1,https://pixabay.com/get/g242ce26b83127c309553c960eb2acc8065a1bc8b445eb7ff5e37b7bb667ac8edb322a64d4a143a344bd52d73b9de65c86408646cb7138b6bc26fb4e1684c5c48_1280.jpg
9460552,authentic,illustration,Unknown,Unknown,Unknown,popular,"insect, bee, beetle, bug, animal, species, nature, macro, ai generated",1130,1005,62,1,https://pixabay.com/get/g16428a9d337b1ff8886e0d6ada8db631e3dda6c27dc6d5c0e02f52c849453ccd0bc6780e0ef1aec38c5e18446e1d1550b0b3df3509a6298059475a8c0e35307e_1280.jpg
9472278,authentic,vector/svg,Unknown,Unknown,Unknown,popular,"digitalization, algorithm, artificial intelligence, superposition, cloud computing, machine learning, big data, cybersecurity, internet of things, blockchain, automation, innovation, disruption, optimization, simulation, cryptography",250,185,22,5,https://pixabay.com/get/ge365533fa0f5e761950433fd8b205a8b6fe727ed4d09b6508cb12db4fdd56c0125e5bcea7d69186afcdaeb29a9f75b0e26ab2a8106f1849c2040f296e020ea92_1280.png
9474397,authentic,illustration,Unknown,Unknown,Unknown,popular,"cross, religion, faith, nature, christian, christianity, symbol, crucifixion, jesus, bible, easter, spring, holiday, celebration, spiritual, historical, copy space, rugged, landscape, sky, scenic",30,20,7,3,https://pixabay.com/get/g48d752bf7ab6dfce2ec4dfb21ace109356c41d1e896912eeb032b340302d59731c8b59946c4dd21887ecaebbe3421cca07caff32ab5e66236438dd75fdda9c9d_1280.jpg
9460554,authentic,illustration,Unknown,Unknown,Unknown,popular,"dragonfly, insect, bug, animal, species, nature, macro, ai generated",1101,980,63,2,https://pixabay.com/get/g85d2fbb08ee51a1af87542244da9a90cf9e58b1207f0c1480a87cba3d69160bfc0f39d8059a59d618a4d8484427e73b38edcc6c7f6a0bdd0d3a05fa8389f151c_1280.jpg
9473484,authentic,illustration,Unknown,Unknown,Unknown,popular,"balance, harmony, polarity, wave, yin, yang, duality, motion, flow, energy, change, transformation, cycle, rhythm, stillness, movement, light, shadow, complementary",83,34,22,3,https://pixabay.com/get/gf93d70cb5b1f4f9f80071870d553cc06d740121b5d321fe98fa867f5622ed6a88a20b4f0e05aee010f675c5e86b4c16d66dab37c35fb8926f798d2cc7b59aa18_1280.jpg
9460555,authentic,illustration,Unknown,Unknown,Unknown,popular,"spider, bug, animal, species, nature, rain, tarantula, arthropods, macro, ai generated",1032,917,62,1,https://pixabay.com/get/g41c3d3d92fbbeac0f2d2cd7bd104d7c91c489bf9a0a9ed68c406f8aa113b96ea1884b2dad15179fd50bb168af1421cce5f7184914ac6c5948d82cee64ab9bc6c_1280.jpg
9460553,authentic,illustration,Unknown,Unknown,Unknown,popular,"silkworm, bug, animal, species, nature, silk, macro, ai generated",1024,906,62,1,https://pixabay.com/get/g257d986de539f0093c3b3f8a9daa4adb29bf1405e66ce6f60b4e96cec48e9d8c8f61fea99010aff783f0bd9fad45df266ac7a1c92da23a78fc30b1e2df0a53a4_1280.jpg
9460557,authentic,illustration,Unknown,Unknown,Unknown,popular,"caterpillar, bug, animal, species, nature, macro, larva, ai generated",945,825,62,1,https://pixabay.com/get/g65d63222682c035ad51429dfa5a1b363f3bedd20fc4b62de1423b18bd9c2a5c63a72f2aac208a10b2d121ff56d439df6fd4f378c346be785534812c38aa57394_1280.jpg
9448972,authentic,illustration,Unknown,Unknown,Unknown,popular,"ai generated, worm, caterpillar, insect, mud, soil, animal, forest, leaves, nature",1605,1337,29,4,https://pixabay.com/get/gc2c814d9bb802dc055562300f757256058f5592a5c2ed0b72677e4a954b1a7e89e101b478bc43f618269e7db06a932b0d4329f950dce77cccb3d01037e51e26e_1280.jpg
9473489,authentic,illustration,Unknown,Unknown,Unknown,popular,"sunset, twilight, horizon, background, landscape, sky, nature, sunrise, pattern, texture, atmosphere, abstract",144,93,21,3,https://pixabay.com/get/gc8f82c3b6d1558307bf3072cba3aeef57c3c22eca9cea4ef1355d067454a9fb33894a3bb4ee26b187c36082d6c933e1f1d563695632bbb29e4f41365b86e276e_1280.jpg
2928142,authentic,illustration,Unknown,Unknown,Unknown,popular,"christmas tree, lights, stars, glowing, shining, shiny, christmas lights, christmas decorations, christmas ornaments, christmas background, christmas, holiday, blue, decoration, christmas, christmas, christmas, christmas, christmas",1693915,597944,2641,558,https://pixabay.com/get/g6eec7e4cbf96e12a3947df72fda14dd04eaaa283c4e144f5b6337d48481d2837ee22c0e949a58fff592ea9411ea20a63815ffa73148a34711b42f1086c8660ea_1280.jpg
9459324,authentic,illustration,Unknown,Unknown,Unknown,popular,"ai generated, woman, model, fashion, art, sweet, youth, flowers, design, face, nature, background, clothes, exposure, beauty",649,567,54,0,https://pixabay.com/get/g725df3c10dc61f999930bd422f51fb98e1643ae3e254f59553ccebd46a64459a6e35a450bd8a85f7ca4c718749d2869b8641bfacb2ca7c532c29184d2ad69dbb_1280.jpg
9456735,authentic,illustration,Unknown,Unknown,Unknown,popular,"abstract, destruction, hope, grief, pain, armageddon, future, peace, diversity, inclusion, equality, equity, unity, harmony, tolerance, respect, empathy, understanding, acceptance",1315,1065,57,16,https://pixabay.com/get/g985713456d4f3bbb43ba628b4b3d344c148cb7af95a822ffdbf95b3288df8e01a5b31767368a9f66e4f1757e45fda65658333dd9d957cb59811440598fe63315_1280.jpg
